{
    "CIÊNCIAS DA NATUREZA E SUAS TECNOLOGIAS": [
        {
            "numero": 91,
            "enunciado": "Três\tinseticidas\t mortais\tpara\tas\tabelhas\tserão\t\nproibidos\t na\tUnião\tEuropeia\t (UE)\tdurante\tdois\tanos,\ta\t\npartir\tde\tjulho,\tanunciou\ta\tComissão\t Europeia\tem\t2013.\t\nA medida foi adotada por causa da morte de milhares de \nabelhas, insetos vitais para o nosso ecossistema, uma vez \nque desempenham um importante papel na agricultura e, \nportanto,\tna\tprodução\tde\talimentos\tpara\ta\thumanidade.\n\t(adaptado).\nO\timpacto\tdos\tinseticidas\t mencionados\t na\tprodução\t de\t\nalimentos\tagrícolas\té\tcausado\tpelo(a)\nA A redução\tda\tprodução\tde\tmel.\nB B decréscimo\tda\ttaxa\tde\tpolinização.\nC C contaminação\tdo\tsolo\tcom\tabelhas\tmortas.\nD D aumento de resíduos tóxicos nos alimentos.\nE E alteração\tda\tcadeia\talimentar\tno\tecossistema.",
            "pergunta": "Pergunta não detectada",
            "alternativas": {
                "A": "A redução\tda\tprodução\tde\tmel.",
                "B": "B decréscimo\tda\ttaxa\tde\tpolinização.",
                "C": "C contaminação\tdo\tsolo\tcom\tabelhas\tmortas.",
                "D": "D aumento de resíduos tóxicos nos alimentos.",
                "E": "E alteração\tda\tcadeia\talimentar\tno\tecossistema."
            },
            "bibliografia": "Disponível\tem:\thttp://noticias.r7.com.\t Acesso\tem:\t24\tmaio\t2013"
        },
        {
            "numero": 92,
            "enunciado": "A\tpreocupação\t com\ta\tsustentabilidade\t faz\tcom\t\nque\tse\tprocurem,\t cada\tvez\tmais,\tmétodos\t eficientes\t\npara a economia de energia elétrica. Um procedimento \nque\tse\tpode\tadotar\té\ta\tsubstituição\t das\tlâmpadas\t\nincandescentes\t por\tlâmpadas\t de\tLED\tnas\tresidências.\t\nUma\tlâmpada\tincandescente, \tque\topera\t8\thoras\tpor\tdia,\t\nfoi substituída por uma de LED. Elas apresentam 60 W e \n8 W de potência nominal de consumo, respectivamente.\nA\tredução\tdo\tconsumo\tde\tenergia\telétrica,\tem\tquilowatt-hora, \t\nobtida durante trinta dias foi\nA A 0,24.\nB B 1,80.\nC C 1,92.\nD D 12,48.\nE E 14,40.",
            "pergunta": "Pergunta não detectada",
            "alternativas": {
                "A": "A 0,24.",
                "B": "B 1,80.",
                "C": "C 1,92.",
                "D": "D 12,48.",
                "E": "E 14,40."
            },
            "bibliografia": "Não Informada"
        },
        {
            "numero": 93,
            "enunciado": "Um dos materiais mais antigos e ainda utilizados na \nrestauração\t dos\tdentes\tsão\tas\tamálgamas,\t um\tproduto\t\nda\tcombinação \tde\tmercúrio\t(Hg)\tcom\tprata\t(Ag)\te\testanho\t\n(Sn),\tcomo\tapresenta\ta\tequação\tquímica:\n24\tAg\t(s)\t+\t8\tSn\t(s)\t+\t37\tHg\t(l)\t→\t12\tAg2Hg3\t(s)\t+\tSn8Hg\t(s)\nOs\tmateriais\t formados\t pelos\telementos\t citados\tsão\t\ncaracterizados como \nA A precipitados.\nB B ligas metálicas.\nC C compostos iônicos.\nD D produtos\tde\toxidação.\nE E compostos cova lentes.",
            "pergunta": "Pergunta não detectada",
            "alternativas": {
                "A": "A precipitados.",
                "B": "B ligas metálicas.",
                "C": "C compostos iônicos.",
                "D": "D produtos\tde\toxidação.",
                "E": "E compostos cova lentes."
            },
            "bibliografia": "Não Informada"
        },
        {
            "numero": 94,
            "enunciado": "A\talteração\tde\thábitats\té\tuma\tcausa\tbem\tdocumentada \t\nno\tque\ttange\tà\tredução\tde\tpopulações\t de\tanfíbios\tno\t\nmundo. Uma pesquisa feita em um remanescente da \nFloresta de Araucária, no município de Fazenda Rio Grande \n(PR),\trevelou\tque\tcerca\tde\t40%\tdas\tespécies\tde\tanfíbios\t\nanuros\tdaquela\tregião\testão\tassociadas\t à\tmata\testudada,\t\ndistribuindo-se\tdesde\to\tseu\tinterior\taté\to\tentorno.\nROSSA-FERES,\tD.\tC.;\tCONTE,\tC.\tE.\t Rev. Bras. de Zoologia ,\nn.\t4,\tdez.\t2007\t(adaptado).\n\nA A Reflorestar\t com\teucaliptos,\t por\tcrescerem\t\nrapidamente.\nB B Modificar\t geneticamente\t as\tespécies\t de\tanuros\t\nnativas.\nC C Soltar anuros criados em cativeiro no fragmento \nflorestal.\nD D Introduzir novas espécies de árvores no fragmento \nflorestal.\nE E Acabar com o desmatamento do remanescente de \nFloresta de Araucária.",
            "pergunta": "Qual\té\ta\tproposta\t adequada\t para\ta\tconservação\t da\t\ndiversidade\tbiológica\tdos\tanuros\tna\tregião\tcitada?",
            "alternativas": {
                "A": "A Reflorestar\t com\teucaliptos,\t por\tcrescerem",
                "B": "B Modificar\t geneticamente\t as\tespécies\t de\tanuros",
                "C": "C Soltar anuros criados em cativeiro no fragmento",
                "D": "D Introduzir novas espécies de árvores no fragmento",
                "E": "E Acabar com o desmatamento do remanescente de"
            },
            "bibliografia": "Não Informada"
        },
        {
            "numero": 95,
            "enunciado": "Um\tmenino\testá\tajudando\t sua\tmãe\tna\tcozinha.\tEla\t\nlhe pede que tire do fogo uma panela que já estava lá há \nbastante\ttempo,\tem\tfogo\tbaixo,\torientando-lhe\t que\ttome\t\ncuidado\tpara\tnão\tse\tqueimar,\tbuscando\t tocar\tapenas\tno\t\ncabo\tde\tmadeira,\te\tnão\tna\tbase\tde\tmetal\tda\tpanela.\nA\tmãe\tlhe\tfez\tessa\trecomendação\t porque\to\tmetal,\tem\t\nrelação\tà\tmadeira,\tapresenta\tmaior\nA A calor\tespecífico.\nB B energia interna.\nC C temperatura.\nD D condutividade térmica.\nE E coeficiente\tde\tdilatação\ttérmica.",
            "pergunta": "Pergunta não detectada",
            "alternativas": {
                "A": "A calor\tespecífico.",
                "B": "B energia interna.",
                "C": "C temperatura.",
                "D": "D condutividade térmica.",
                "E": "E coeficiente\tde\tdilatação\ttérmica."
            },
            "bibliografia": "Não Informada"
        },
        {
            "numero": 96,
            "enunciado": "O Brasil foi o primeiro país a usar o álcool em \nlarga escala como combustível de automóvel. Hoje, \na indústria automobilística produz e equipa os \nautomóveis com motores que funcionam tanto com \ngasolina como com álcool, ou ainda com uma mistura \ndos dois. No Brasil, o álcool é obtido principalmente \nda\tcana-de-açúcar,\t razão\tpela\tqual\to\tclassificam\t como\t\nbiocombustível.\nCom\tessa\tatitude,\tcontribui-se\tdiretamente\tpara\ta\nA A preservação\tde\trios\te\tlagos.\nB B preservação\tda\tbiodiversidade.\nC C diminuição\tdo\tburaco\tda\tcamada\tde\tozônio.\nAZ2*\nCN - 2° dia | Caderno 7 - AZUL - 2ª Aplicação 3\nENEM 2022 ENEM 2022 ENEM 2022 ENEM 2022 ENEM 2022 ENEM 2022 ENEM 2022 ENEM 2022 ENEM 2022 ENEM 2022 ENEM 2022 ENEM 2022 ENEM 2022 ENEM 2022 ENEM 2022 ENEM 2022 ENEM 2022 ENEM 2022 ENEM 2022 ENEM 2022 ENEM 2022 ENEM 2022 ENEM 2022 ENEM 2022 ENEM 2022 ENEM 2022 ENEM 2022 ENEM 2022 ENEM 2022 ENEM 2022 ENEM 2022 ENEM 2022 ENEM 2022 ENEM 2022 ENEM 2022 ENEM 2022 ENEM 2022 ENEM 2022 ENEM 2022 ENEM 2022 ENEM 2022 ENEM 2022 ENEM 2022 ENEM 2022 ENEM 2022 ENEM 2022 ENEM 2022 ENEM 2022 ENEM 2022 ENEM 2022 ENEM 2022 ENEM 2022 ENEM 2022 ENEM 2022 ENEM 2022 ENEM 2022 ENEM 2022 ENEM 2022 ENEM 2022 ENEM 2022 ENEM 2022 ENEM 2022 ENEM 2022",
            "pergunta": "Pergunta não detectada",
            "alternativas": {
                "A": "A preservação\tde\trios\te\tlagos.",
                "B": "B preservação\tda\tbiodiversidade.",
                "C": "C diminuição\tdo\tburaco\tda\tcamada\tde\tozônio."
            },
            "bibliografia": "D D preservação\tde\tespécies\tameaçadas\tde\textinção.\nE E diminuição\t da\temissão\tefetiva\tde\tdióxido\tde\tcarbono.*020325"
        },
        {
            "numero": 97,
            "enunciado": "O timol é encontrado em óleos essenciais de ervas \naromáticas, como o tomilho e o orégano. Apesar de \npouco\tsolúvel\tem\tágua,\to\ttimol\té\tsolúvel\tem\tuma\tsolução\t\nde hidróxido de sódio.\nOH\nTimol\nA\tdissolução\t desse\tcomposto\t em\tuma\tsolução\tde\t\nhidróxido\tde\tsódio\tse\tdeve\tao(à)\t\nA A formação\tde\tum\tsal\torgânico.\nB B ataque dos íons hidróxido ao anel aromático.\nC C complexação\t dos\telétrons\tpi\tdo\tanel\taromático\t com\t\no íon sódio.\nD D formação\t de\tligações\tde\thidrogênio\t entre\ta\thidroxila\t\nfenólica do timol e os íons hidróxido.\nE E aumento da polaridade do solvente mediante a \ndissolução\tdo\thidróxido\tde\tsódio\tna\tágua.",
            "pergunta": "Pergunta não detectada",
            "alternativas": {
                "A": "A formação\tde\tum\tsal\torgânico.",
                "B": "B ataque dos íons hidróxido ao anel aromático.",
                "C": "C complexação\t dos\telétrons\tpi\tdo\tanel\taromático\t com",
                "D": "D formação\t de\tligações\tde\thidrogênio\t entre\ta\thidroxila",
                "E": "E aumento da polaridade do solvente mediante a"
            },
            "bibliografia": "Não Informada"
        },
        {
            "numero": 98,
            "enunciado": "Uma\tferramenta\t biotecnológica\t para\tidentificação\t\nde cadáveres é a análise de seu DNA mitocondrial e a \ncomparação\t com\to\tDNA\tmitocondrial\t de\tpessoas\tde\tuma\t\nfamília\tque\testeja\treivindicando\t o\tcorpo.\tSabe-se\tque\ta\t\nherança mitocondrial é materna.\nEstão\tdisponíveis\t os\tseguintes\t membros\t de\tuma\t\nfamília\tque\tpoderiam\t doar\tmaterial\tpara\ta\tconfirmação\t\nda identidade de um cadáver por meio da análise de DNA \nmitocondrial:\n1.\ta\tsobrinha,\tfilha\tde\tum\tirmão;\n2.\ta\ttia,\tirmã\tde\tseu\tpai;\n3.\to\tprimo,\tfilho\tda\tirmã\tde\tsua\tmãe;\n4. o avô materno;\n5.\ta\tprima,\tfilha\tdo\tirmão\tde\tsua\tmãe.\n\t(adaptado).\nA\tconfirmação\t da\tidentidade\t do\tcadáver\tserá\tpossível\t\ncom\ta\tutilização\tdo\tDNA \tmitocondrial\tdo(a)\nA A sobrinha.\nB B tia.\nC C primo.\nD D avô.\nE E prima.",
            "pergunta": "Pergunta não detectada",
            "alternativas": {
                "A": "A sobrinha.",
                "B": "B tia.",
                "C": "C primo.",
                "D": "D avô.",
                "E": "E prima."
            },
            "bibliografia": "SYKES, B. As sete filhas de Eva: a ciência que revela nossa herança genética.\nRio\tde\tJaneiro:\tRecord,\t2003"
        },
        {
            "numero": 99,
            "enunciado": "Escrito\tem\t1897,\tpelo\tbritânico\tH.\tG.\tWells\t(1866-\n1946), O homem invisível  é um livro que narra a história \nde um cientista que teria desenvolvido uma forma de \ntornar todos os tecidos do seu corpo transparentes à luz, \nao\tfazer\to\tíndice\tde\trefração\tabsoluto\tdo\tcorpo\thumano\t\ncorresponder\t ao\tdo\tar.\tContudo,\t Wells\tnão\texplorou\tno\t\nlivro\to\tfato\tde\tque\tesse\tefeito\tcomprometeria\t a\tvisão\tde\t\nseu protagonista.\n\nA A Miopia.\nB B Cegueira.\nC C Daltonismo.\nD D Astigmatismo.\nE E Hipermetropia.",
            "pergunta": "Nesse\tcaso,\tqual\tseria\ta\tdeficiência\tvisual\tprovocada?",
            "alternativas": {
                "A": "A Miopia.",
                "B": "B Cegueira.",
                "C": "C Daltonismo.",
                "D": "D Astigmatismo.",
                "E": "E Hipermetropia."
            },
            "bibliografia": "Não Informada"
        },
        {
            "numero": 100,
            "enunciado": "A bula de um determinado medicamento traz as \nseguintes informações:\nVolume do frasco\t=\t500\tmL\tde\tsolução\nComposição:\nCloreto de potássio = 75 mg\nCloreto de sódio = 0,07 g\nGlicose = 0,00008 kg\nDe acordo com as informações apresentadas na bula, \na\tsubstância\t que\tse\tencontra\t em\tmaior\tconcentração \t\ne\ta\tnão\tcondutora\t de\tcorrente\telétrica,\tquando\tem\t\nsolução\taquosa,\tsão,\trespectivamente,\nA A glicose e glicose.\nB B glicose e cloreto de sódio.\nC C cloreto de sódio e glicose.\nAZ3*\n4 \nCN - 2° dia | Caderno 7 - AZUL - 2ª Aplicação\nENEM 2022 ENEM 2022 ENEM 2022 ENEM 2022 ENEM 2022 ENEM 2022 ENEM 2022 ENEM 2022 ENEM 2022 ENEM 2022 ENEM 2022 ENEM 2022 ENEM 2022 ENEM 2022 ENEM 2022 ENEM 2022 ENEM 2022 ENEM 2022 ENEM 2022 ENEM 2022 ENEM 2022 ENEM 2022 ENEM 2022 ENEM 2022 ENEM 2022 ENEM 2022 ENEM 2022 ENEM 2022 ENEM 2022 ENEM 2022 ENEM 2022 ENEM 2022 ENEM 2022 ENEM 2022 ENEM 2022 ENEM 2022 ENEM 2022 ENEM 2022 ENEM 2022 ENEM 2022 ENEM 2022 ENEM 2022 ENEM 2022 ENEM 2022 ENEM 2022 ENEM 2022 ENEM 2022 ENEM 2022 ENEM 2022 ENEM 2022 ENEM 2022 ENEM 2022 ENEM 2022 ENEM 2022 ENEM 2022 ENEM 2022 ENEM 2022 ENEM 2022 ENEM 2022 ENEM 2022 ENEM 2022 ENEM 2022 ENEM 2022",
            "pergunta": "Pergunta não detectada",
            "alternativas": {
                "A": "A glicose e glicose.",
                "B": "B glicose e cloreto de sódio.",
                "C": "C cloreto de sódio e glicose."
            },
            "bibliografia": "D D cloreto de potássio e glicose.\nE E cloreto de sódio e cloreto de po tássio.*020325"
        },
        {
            "numero": 101,
            "enunciado": "Um dos fármacos usados como quimioterápico contra \no\tcâncer\té\ta\tcolchicina.\t Ela\tage\tcomo\tum\tbloqueador\t\nda\tdivisão\tcelular,\tintervindo\t na\tpolimerização\t dos\t\nmicrotúbulos,\t formadores\t das\tfibras\tdo\tfuso\tacromático,\t\ninibindo, assim, o crescimento do tumor.\nA\tcolchicina\tage\tno\ttratamento\tdo\tcâncer,\tpois\nA A inibe a atividade das mitocôndrias, diminuindo a \nprodução\tde\t ATP.\nB B bloqueia a síntese proteica, o que impede a \npolimerização\tdos\tmicrotúbulos.\nC C impede\ta\tpolimerização\t do\tfuso,\tque\tpromove\t a\t\ncondensação\tda\tcromatina\tnuclear.\nD D causa\ta\tdespolimerização\t de\tproteínas\t do\tfuso,\t\nimpedindo\t a\tseparação\t das\tcélulas-filhas\t no\tfinal\tda\t\nmitose.\nE E promove\t a\tdespolimerização\t das\tfibras\tdo\tfuso,\t\nimpossibilitando\t a\tseparação \tdos\tcromossomos\t na\t\ndivisão.",
            "pergunta": "Pergunta não detectada",
            "alternativas": {
                "A": "A inibe a atividade das mitocôndrias, diminuindo a",
                "B": "B bloqueia a síntese proteica, o que impede a",
                "C": "C impede\ta\tpolimerização\t do\tfuso,\tque\tpromove\t a",
                "D": "D causa\ta\tdespolimerização\t de\tproteínas\t do\tfuso,",
                "E": "E promove\t a\tdespolimerização\t das\tfibras\tdo\tfuso,"
            },
            "bibliografia": "Não Informada"
        },
        {
            "numero": 102,
            "enunciado": "Os\tcombustíveis\t são\tmateriais\tutilizados\t na\tprodução\t\nde\tenergia\tque,\tdependendo\t da\tsua\tcomposição,\tpodem\t\nproduzir\tdiferentes\t substâncias.\t Por\texemplo,\t numa\t\nqueima completa, o hidrogênio se transforma em H2O; e \no carbono, em CO2.\nO\tquadro\tapresenta\t as\tentalpias\t de\tcombustão\t de\t\nalguns\tcombustíveis\tnas\tcondições\tpadrão.\nCombustível FórmulaEntalpia padrão de \ncombustão kJ\nmol/g167\n/g169/g168/g183\n/g185/g184\nCarbono C -394\nEtino C2H2-1 300\nPropano C3H8-2 220\nButano C4H10-2 878\nOctano C8H18-5 471\nATKINS, P.; JONES, L.; LAVERMAN, L. Princípios de química : questionando a vida \nmoderna\te\to\tmeio\tambiente.\tSão\tPaulo:\tBookman,\t2018\t(adaptado).\n\nA A Carbono.\nB B Etino.\nC C Propano.\nD D Butano.\nE E Octano.",
            "pergunta": "Visando\ta\tredução\tdo\timpacto\tambiental,\t qual\tdos\t\ncombustíveis listados libera maior quantidade de energia \ncom\tmenor\tprodução\tde\tCO2?",
            "alternativas": {
                "A": "A Carbono.",
                "B": "B Etino.",
                "C": "C Propano.",
                "D": "D Butano.",
                "E": "E Octano."
            },
            "bibliografia": "Não Informada"
        },
        {
            "numero": 103,
            "enunciado": "Em muitos animais, machos e fêmeas da mesma \nespécie apresentam diferenças morfológicas ou \ncomportamentais evidentes. Um exemplo clássico de \ndimorfismo\t sexual\té\to\tcaso\tdo\tpavão,\tem\tque\to\tmacho\t\npossui\tcauda\tvistosa\te\tpenas\tcoloridas,\t as\tquais\testão\t\nausentes nas fêmeas. Em outras espécies, os machos \npossuem chifres, garras ou dentes maiores do que \nas fêmeas, e utilizam essas estruturas em combates \nfísicos para defender territórios e ter acesso a fêmeas \ncoespecíficas\te\treceptivas.\nEsse\tpadrão\tde\tdimorfismo\tevolui\tporque\nA A desenvolve-se\t no\tprocesso\tdirecional\t de\tderiva\t\ngenética.\nB B as\tfêmeas\tsofrem\tmenor\tpressão\tseletiva\ttotal\tdo\t\nambiente.\nC C machos\te\tfêmeas\tcoespecíficos\t são\tfenotipicamente\t\ndistintos.\nD D a\tseleção\tsexual\tfavorece\t o\tsucesso\treprodutivo\t\nindividual\tde\tmachos\tdimórficos.\nE E o\tmaterial\tgenético\tde\tmachos\tdimórficos\t é\tmais\t\nsusceptível a mutações gênicas.",
            "pergunta": "Pergunta não detectada",
            "alternativas": {
                "A": "A desenvolve-se\t no\tprocesso\tdirecional\t de\tderiva",
                "B": "B as\tfêmeas\tsofrem\tmenor\tpressão\tseletiva\ttotal\tdo",
                "C": "C machos\te\tfêmeas\tcoespecíficos\t são\tfenotipicamente",
                "D": "D a\tseleção\tsexual\tfavorece\t o\tsucesso\treprodutivo",
                "E": "E o\tmaterial\tgenético\tde\tmachos\tdimórficos\t é\tmais"
            },
            "bibliografia": "Não Informada"
        },
        {
            "numero": 104,
            "enunciado": "Carregadores\t elétricos\t são\tprojetados\t para\t\nfornecerem energia a baterias recarregáveis, como as \nusadas\tem\taparelhos\t celulares\te\tmáquinas\t fotográficas.\t\nAs\tespecificações\ttípicas\tde\tum\tdesses\tdispositivos\tsão:\nCarregador:\nEntrada\tAC\t100-240\tV\t/\t200\tmA \t/\t50-60\tHz\nSaída DC 5,0 V / 1 000 mA\nBateria recarregável:\n1,5 V / 4 000 mAh\nUsando o carregador com corrente máxima, o tempo total \nde recarga dessa bateria totalmente descarregada, em \nhora, é\nA A 1\n6.\nB B 5\n6.\nC C 4.\nAZ4*\nCN - 2° dia | Caderno 7 - AZUL - 2ª Aplicação 5\nENEM 2022 ENEM 2022 ENEM 2022 ENEM 2022 ENEM 2022 ENEM 2022 ENEM 2022 ENEM 2022 ENEM 2022 ENEM 2022 ENEM 2022 ENEM 2022 ENEM 2022 ENEM 2022 ENEM 2022 ENEM 2022 ENEM 2022 ENEM 2022 ENEM 2022 ENEM 2022 ENEM 2022 ENEM 2022 ENEM 2022 ENEM 2022 ENEM 2022 ENEM 2022 ENEM 2022 ENEM 2022 ENEM 2022 ENEM 2022 ENEM 2022 ENEM 2022 ENEM 2022 ENEM 2022 ENEM 2022 ENEM 2022 ENEM 2022 ENEM 2022 ENEM 2022 ENEM 2022 ENEM 2022 ENEM 2022 ENEM 2022 ENEM 2022 ENEM 2022 ENEM 2022 ENEM 2022 ENEM 2022 ENEM 2022 ENEM 2022 ENEM 2022 ENEM 2022 ENEM 2022 ENEM 2022 ENEM 2022 ENEM 2022 ENEM 2022 ENEM 2022 ENEM 2022 ENEM 2022 ENEM 2022 ENEM 2022 ENEM 2022",
            "pergunta": "Pergunta não detectada",
            "alternativas": {
                "A": "A 1",
                "B": "B 5",
                "C": "C 4."
            },
            "bibliografia": "D D 6.\nE E 8.*020325"
        },
        {
            "numero": 105,
            "enunciado": "Um\tmultímetro\t pode\tatuar\tcomo\tvoltímetro\t (leitura\t\nem\tvolt)\tou\tcomo\tamperímetro\t (leitura\tem\tampère),\t\ndependendo\t da\tfunção\tselecionada.\t A\tforma\tde\tconectar\t\no multímetro ao circuito depende da grandeza física a \nser\tmedida.\tUma\tlâmpada\tde\tlanterna,\t de\tresistência\t\nelétrica igual a 40 Ω, brilha quando conectada a quatro \npilhas\tem\tsérie,\tcada\tuma\tcom\t1,5\tV\tde\ttensão\telétrica.\t\nO\tmultímetro\t2\tindica\t o\tvalor\t5,62,\tconforme\t a\tfigura,\te\to\t\nmultímetro 1 está conectado, porém desligado.\nMultímetro 1Multímetro 2\nLâmpadaLâmpada\nPilhas em série\nAo se ligar o multímetro 1, a grandeza física e o seu valor \ncorrespondente\tindicados\tna\ttela\tsão,\trespectivamente,\nA A corrente elétrica e 0,14.\nB B corrente elétrica e 0,15.\nC C corrente elétrica e 0,29.\nD D tensão\telétrica\te\t0,14.\nE E tensão\telétrica\te\t225.",
            "pergunta": "Pergunta não detectada",
            "alternativas": {
                "A": "A corrente elétrica e 0,14.",
                "B": "B corrente elétrica e 0,15.",
                "C": "C corrente elétrica e 0,29.",
                "D": "D tensão\telétrica\te\t0,14.",
                "E": "E tensão\telétrica\te\t225."
            },
            "bibliografia": "Não Informada"
        },
        {
            "numero": 106,
            "enunciado": "Solos ácidos apresentam baixo valor de pH, e o \nplantio\tde\tculturas\tnesse\tmeio\tacarreta\tbaixa\tprodução\t\nagrícola. Entretanto, esse problema pode ser contornado \nadicionando-se\t substâncias\t que,\tao\tentrarem\tem\tcontato\t\ncom a água, liberam íons OH−, que neutralizam os íons \nH3O+ presentes no solo e elevam o seu pH. Para esse \nobjetivo,\tum\tagricultor\t tem\tcomercialmente\t à\tdisposição\t\nas espécies químicas enumeradas:\nI – KCl     II – MgO     III – NH4Br     IV – AlCl3     V – P2O5\nPara\ta\tcorreção\tdo\tpH\tdesse\tsolo,\to\tagricultor\t deverá\t\nutilizar a espécie química indicada pelo número\nA A I.\nB B II.\nC C III.\nD D IV.\nE E V.",
            "pergunta": "Pergunta não detectada",
            "alternativas": {
                "A": "A I.",
                "B": "B II.",
                "C": "C III.",
                "D": "D IV.",
                "E": "E V."
            },
            "bibliografia": "Não Informada"
        },
        {
            "numero": 107,
            "enunciado": "O feixe de um laser incide obliquamente na lateral de \numa\tjanela\tde\tvidro,\tcujo\tíndice\tde\trefração\té\tmaior\tdo\tque\t\no\tdo\tar,\te\ta\tatravessa.\t Uma\trepresentação\t esquemática\t\ndessa\tsituação\tutiliza\tlinhas\tpontilhadas\t para\tdemonstrar\t\na\ttrajetória\tque\to\tfeixe\tteria,\tcaso\tnão\tsofresse\trefração,\t\ne linhas contínuas com setas para mostrar a trajetória \nrealmente seguida pelo feixe.\n\nA\nB\nC\nD\nE*020325AZ5*\n6 \nCN - 2° dia | Caderno 7 - AZUL - 2ª Aplicação",
            "pergunta": "Qual\trepresentação\t esquemática\t apresenta\t a\ttrajetória\t\nseguida pelo feixe de laser quando atravessa a janela de \nvidro?",
            "alternativas": {
                "A": "B",
                "C": "D"
            },
            "bibliografia": "Não Informada"
        },
        {
            "numero": 108,
            "enunciado": "Considere \tque\to\tleite\tmaterno,\t após\tsete\tmeses\tdo\tparto,\té\tum\talimento\tcujos\tprincipais\t constituintes\t são\t\nlipídeos. Uma mulher que está amamentando ingere, rotineiramente, alimentos contaminados com os pesticidas HCB, \nDDT,\tatrazina,\tparation\te\tmalation,\tcujas\testruturas\t e\tdados\tde\tsolubilidade\t em\tágua\testão\tapresentados\t no\tquadro.\nPesticida Atrazina DDT HCB Malation Paration\nSolubilidade em água (ppm) 35-70 0,0034 0,0062 145 24\nNN\nNCl NH\nCC\nHCl ClCl\nCl Cl\nCl\nCl\nCl\nClClCl\nO\nPO\nSONO2\nAtrazinaDDT\nHCB Malation ParationOP\nOS\nS\nOOOO\nO\tpesticida\ttransmitido\ta\tum\tlactente\t(bebê\tem\tamamentação)\tde\tdez\tmeses,\tem\tmaior\tproporção,\té\to:\nA A Atrazina.\nB B DDT.\nC C HCB.\nD D Malation.\nE E Paration.",
            "pergunta": "Pergunta não detectada",
            "alternativas": {
                "A": "A Atrazina.",
                "B": "B DDT.",
                "C": "C HCB.",
                "D": "D Malation.",
                "E": "E Paration."
            },
            "bibliografia": "Não Informada"
        },
        {
            "numero": 109,
            "enunciado": "Atividades\t humanas\t como\ta\tconstrução\t de\testradas\te\tferrovias\te\ta\texpansão\t de\táreas\turbanas\te\tagrícolas\t\ncontribuem\t de\tforma\tdeterminante\t para\ta\tredução\tdas\táreas\tde\tvegetação\t original,\tem\tum\tprocesso\t conhecido\t\ncomo\tfragmentação\t do\thábitat.\tParticularmente\t marcante\t em\táreas\tde\tfloresta,\tos\timpactos\tsofridos\tpela\tbiota\tnão\t\nestão\trestritos\tà\tredução\tdo\thábitat,\tmas\ttambém\tà\tmodificação\t das\tsuas\tcaracterísticas\t internas,\tcomo\ta\tdiminuição\t\nda umidade do ar e o aumento nos níveis de luminosidade, temperatura e vento. Esse conjunto de alterações no \nfragmento\té\tconhecido\tcomo\t“efeito\tde\tborda”,\tpodendo\tse\testender\tpor\tvários\tmetros\tem\tdireção\tao\tseu\tinterior.\t\nAs\tespécies\tvegetais\tdiretamente\tprejudicadas\tpor\tesse\tefeito\tsão\tas\nA A exóticas.\nB B polinizadas pelo vento.\nC C com\tbaixo\tpotencial\tde\tdispersão.\nAZ6*\nCN - 2° dia | Caderno 7 - AZUL - 2ª Aplicação 7\nENEM 2022 ENEM 2022 ENEM 2022 ENEM 2022 ENEM 2022 ENEM 2022 ENEM 2022 ENEM 2022 ENEM 2022 ENEM 2022 ENEM 2022 ENEM 2022 ENEM 2022 ENEM 2022 ENEM 2022 ENEM 2022 ENEM 2022 ENEM 2022 ENEM 2022 ENEM 2022 ENEM 2022 ENEM 2022 ENEM 2022 ENEM 2022 ENEM 2022 ENEM 2022 ENEM 2022 ENEM 2022 ENEM 2022 ENEM 2022 ENEM 2022 ENEM 2022 ENEM 2022 ENEM 2022 ENEM 2022 ENEM 2022 ENEM 2022 ENEM 2022 ENEM 2022 ENEM 2022 ENEM 2022 ENEM 2022 ENEM 2022 ENEM 2022 ENEM 2022 ENEM 2022 ENEM 2022 ENEM 2022 ENEM 2022 ENEM 2022 ENEM 2022 ENEM 2022 ENEM 2022 ENEM 2022 ENEM 2022 ENEM 2022 ENEM 2022 ENEM 2022 ENEM 2022 ENEM 2022 ENEM 2022 ENEM 2022 ENEM 2022",
            "pergunta": "Pergunta não detectada",
            "alternativas": {
                "A": "A exóticas.",
                "B": "B polinizadas pelo vento.",
                "C": "C com\tbaixo\tpotencial\tde\tdispersão."
            },
            "bibliografia": "D D pertencentes à comunidade clímax.\nE E que apresentam grande área de vida.*020325"
        },
        {
            "numero": 110,
            "enunciado": "A\tfim\tde\treaproveitar\t o\tresíduo\tde\tum\tprocesso\t\nindustrial,\t cuja\tcomposição\t está\tindicada,\t foi\tproposto\t\num tratamento seguindo o esquema de separações \napresentado.\nFração \naquosa INaHCO3 (aq)Resíduo dissolvido em éter etílico\nFração\netérea I\nNaOH (aq)\nHCI (aq)Fração \naquosa IIFração\netérea IIFração \naquosa III\nFração\netérea IIIFenol\nAnilinaÁcido acético\nAcetonaOH\nNH2C\nCH3 CH3OCH3 C\nOHO\n.\nOs\tcomponentes\t do\tresíduo\tque\testão\tpresentes\t nas\t\nfrações\taquosas\tII\te\tIII\tsão,\trespectivamente,\nA A fenol e anilina.\nB B fenol e acetona.\nC C anilina e acetona.\nD D ácido acético e anilina.\nE E ácido acético e acetona.",
            "pergunta": "Pergunta não detectada",
            "alternativas": {
                "A": "A fenol e anilina.",
                "B": "B fenol e acetona.",
                "C": "C anilina e acetona.",
                "D": "D ácido acético e anilina.",
                "E": "E ácido acético e acetona."
            },
            "bibliografia": "ENGEL, R. G. et al. Química orgânica experimental.\tSão\tPaulo:\tCengage\tLearning,\t2012"
        },
        {
            "numero": 111,
            "enunciado": "Em virtude do frio intenso, um casal adquire uma \ntorneira elétrica para instalar na cozinha. Um eletricista \né contratado para fazer um novo circuito elétrico para a \ncozinha,\tcuja\tcorrente\tserá\tde\t30\tA,\tcom\ta\tfinalidade\t de\t\nalimentar os terminais da torneira elétrica. Ele utilizou \num\tpar\tde\tfios\tde\tcobre,\tde\tárea\tda\tseção\treta\tigual\ta\t\n4 mm2 e de 28 m de comprimento total, desde o quadro \nde\tdistribuição\t (onde\tficam\tos\tdisjuntores)\t até\ta\tcozinha.\t\nA\ttensão\tmedida\tna\tsaída\tdo\tquadro\tde\tdistribuição\t é\t\n220\tV.\tConsidere\t que\ta\tresistividade\t do\tfio\tde\tcobre\té\tde\t\n17108,/g117/g16/g58/g152m.\nConsiderando\t a\tresistência\t da\tfiação,\ta\ttensão\taplicada\t\naos terminais da torneira é mais próxima de\nA A 211 V.\nB B 213 V.\nC C 216 V.\nD D 219 V.\nE E 220 V.",
            "pergunta": "Pergunta não detectada",
            "alternativas": {
                "A": "A 211 V.",
                "B": "B 213 V.",
                "C": "C 216 V.",
                "D": "D 219 V.",
                "E": "E 220 V."
            },
            "bibliografia": "Não Informada"
        },
        {
            "numero": 112,
            "enunciado": "Bebidas alcoólicas, algumas soluções desinfetantes \nou\taté\tálcool\tcombustível\t são\texemplos\t de\tmisturas\t\nconstituídas\t por\tetanol\t(CH3CH2OH)\te\tágua.\tA\t“afinidade”\t\nentre\tesses\tlíquidos\té\tsuficiente\t para\tpossibilitar\t que\ta\t\nmistura formada por 500 mL de água e 500 mL de etanol \norigine\tuma\tsolução\tde\t970\tmL,\tem\tum\tprocesso\t que\t\nenvolve\tliberação\t de\tpequena\t quantidade\t de\tenergia.\t\nDe certa forma, isso constitui um problema para os \nfabricantes, uma vez que, para obterem um litro dessa \nmistura, necessitariam misturar mais do que 500 mL de \ncada um dos líquidos.\n\nA A À\tredução\tdo\tvolume\tdas\tmoléculas.\nB B Ao abaixamento da massa molecular.\nC C À\tformação\tde\tligações\tcovalentes\tmais\tfortes.\nD D À\tdiminuição\tdo\tgrau\tde\tagitação\tdas\tmoléculas.\nE E Ao estabelecimento de interações intermoleculares \nmais intensas.*020325AZ7*\n8 \nCN - 2° dia | Caderno 7 - AZUL - 2ª Aplicação\nENEM 2022 ENEM 2022 ENEM 2022 ENEM 2022 ENEM 2022 ENEM 2022 ENEM 2022 ENEM 2022 ENEM 2022 ENEM 2022 ENEM 2022 ENEM 2022 ENEM 2022 ENEM 2022 ENEM 2022 ENEM 2022 ENEM 2022 ENEM 2022 ENEM 2022 ENEM 2022 ENEM 2022 ENEM 2022 ENEM 2022 ENEM 2022 ENEM 2022 ENEM 2022 ENEM 2022 ENEM 2022 ENEM 2022 ENEM 2022 ENEM 2022 ENEM 2022 ENEM 2022 ENEM 2022 ENEM 2022 ENEM 2022 ENEM 2022 ENEM 2022 ENEM 2022 ENEM 2022 ENEM 2022 ENEM 2022 ENEM 2022 ENEM 2022 ENEM 2022 ENEM 2022 ENEM 2022 ENEM 2022 ENEM 2022 ENEM 2022 ENEM 2022 ENEM 2022 ENEM 2022 ENEM 2022 ENEM 2022 ENEM 2022 ENEM 2022 ENEM 2022 ENEM 2022 ENEM 2022 ENEM 2022 ENEM 2022 ENEM 2022",
            "pergunta": "Do\tponto\tde\tvista\tda\tquímica,\ta\tque\tse\tdeve\tessa\tvariação\t\nde\tvolume?",
            "alternativas": {
                "A": "A À\tredução\tdo\tvolume\tdas\tmoléculas.",
                "B": "B Ao abaixamento da massa molecular.",
                "C": "C À\tformação\tde\tligações\tcovalentes\tmais\tfortes.",
                "D": "D À\tdiminuição\tdo\tgrau\tde\tagitação\tdas\tmoléculas.",
                "E": "E Ao estabelecimento de interações intermoleculares"
            },
            "bibliografia": "Não Informada"
        },
        {
            "numero": 113,
            "enunciado": "O\tfenol\t(hidroxi-benzeno)\t e\tvários\tde\tseus\t\nderivados\t são\tcompostos\t tóxicos\tpresentes\t na\tlista\t\nde\tpoluentes\t prioritários\t da\tAgência\t de\tProteção\t\nAmbiental\t norte-americana,\t totalizando\t 11\tfenóis\t\ndas\t129\tsubstâncias\t presentes\t na\tlista.\tNo\tBrasil,\ta\t\n,\tlimitava\t\no teor máximo de fenóis, para lançamento em corpos \nde água doce, em 0,5 ppm.\nResolução\tConama\tn.\t20,\tde\t18\tde\tjunho\tde\t1986.\nDiário Oficial da União ,\tde\t30\tjul.\t1986\t(adaptado).\nA\tsolução\trecomendável\t para\to\tdescarte\tde\tefluentes\t\nindustriais contendo fenol é\nA A incinerar\to\tefluente.\nB B aquecer a mistura para evaporar o fenol.\nC C armazenar\to\trejeito\tem\tpiscinas\tde\tcontenção.\nD D extrair\te\treinserir\to\tproduto\tna\tlinha\tde\tprodução.\nE E adicionar\t água\tsuficiente\t para\tpermitir\to\tdespejo\t\nnos rios.",
            "pergunta": "Pergunta não detectada",
            "alternativas": {
                "A": "A incinerar\to\tefluente.",
                "B": "B aquecer a mistura para evaporar o fenol.",
                "C": "C armazenar\to\trejeito\tem\tpiscinas\tde\tcontenção.",
                "D": "D extrair\te\treinserir\to\tproduto\tna\tlinha\tde\tprodução.",
                "E": "E adicionar\t água\tsuficiente\t para\tpermitir\to\tdespejo"
            },
            "bibliografia": "Resolução\t Federal\t(Conama)\t n.\t20,\tde\t1986"
        },
        {
            "numero": 114,
            "enunciado": "No ciclo biogeoquímico do nitrogênio participam \nvários organismos vivos. Um dos efeitos desse \nciclo é aumentar a disponibilidade dos compostos \nnitrogenados no solo.\nAs minhocas participam desse ciclo quando\nA A oxida m o nitrito a nitrato.\nB B reduzem o nitrito a amônia.\nC C oxidam\ta\tamônia\tliberada\tda\tmatéria\torgânica.\nD D transformam\ta\tmatéria\torgânica,\tliberando\tamônia.\nE E fixam\to\tnitrogênio\t molecular\tpresente\tno\tar\tatmosférico.",
            "pergunta": "Pergunta não detectada",
            "alternativas": {
                "A": "A oxida m o nitrito a nitrato.",
                "B": "B reduzem o nitrito a amônia.",
                "C": "C oxidam\ta\tamônia\tliberada\tda\tmatéria\torgânica.",
                "D": "D transformam\ta\tmatéria\torgânica,\tliberando\tamônia.",
                "E": "E fixam\to\tnitrogênio\t molecular\tpresente\tno\tar\tatmosférico."
            },
            "bibliografia": "Não Informada"
        },
        {
            "numero": 115,
            "enunciado": "Na área de comunicações, a demanda por \ngrande\tvolume\tde\tdados\texige\tuma\ttransmissão\t em\t\nalta\tfrequência.\t Uma\tinovação\t nesse\tsentido\tfoi\to\t\ndesenvolvimento\t da\tfibra\tóptica,\tque\tfaz\tuso\tda\tluz\t\ncomo\tportadora\t de\tsinais.\tA\tfibra\tóptica\té\tum\tmeio\tde\t\npropagação\t da\tluz\tformada\tpor\tduas\tcamadas\t de\tvidro,\t\ncom\tíndices\tde\trefração\tdiferentes.\t Considere\t que\ta\t\ncamada\texterna\tda\tfibra\tapresente\t índice\tde\trefração\tn2, \ne\ta\tcamada\tinterna,\tíndice\tde\trefração\tn1, como ilustrado \nna\tfigura.\nn2\nn1\nLuz incidente\nO\tobjetivo\tdessa\tdiferença\t é\tobter\ta\tcondição\t de\t\nreflexão\tinterna\ttotal\tdo\tsinal\tóptico\tque\tse\tencontre\tna\t\ncamada interna, de forma que ele se propague por toda \na\textensão\tda\tfibra.\nA\ttecnologia\t envolvida\t na\tconfecção\t das\tfibras\tópticas\t\ndeve\tgarantir\tque\to\tângulo\tde\trefração\te\ta\trelação\tentre\t\nn1 e n2 sejam, respectivamente,\nA 4521°enn/g3/g3 /g3/g31/g3.\nB nuloenn/g3/g3 /g3/g33/g321 .\nC nuloenn/g3/g3 /g3/g31/g321 .\nD 90°en n /g3/g3 /g3/g33/g321 .\nE 90°en n /g3/g3 /g3/g31/g321 .",
            "pergunta": "Pergunta não detectada",
            "alternativas": {
                "A": "4521°enn/g3/g3 /g3/g31/g3.",
                "B": "nuloenn/g3/g3 /g3/g33/g321 .",
                "C": "nuloenn/g3/g3 /g3/g31/g321 .",
                "D": "90°en n /g3/g3 /g3/g33/g321 .",
                "E": "90°en n /g3/g3 /g3/g31/g321 ."
            },
            "bibliografia": "Não Informada"
        },
        {
            "numero": 116,
            "enunciado": "Em\tum\tsistema\thipotético\t mantido\tsob\tiluminação,\t\nestão\tpresentes\t uma\tcélula\tautotrófica\t e\tuma\tcélula\t\nheterotrófica.\t A\tesse\tsistema\tsão\tfornecidos\t água,\tglicose\t\ne gás oxigênio, sendo esse último na forma de 18O2.\nAo\tfinal\tde\tum\tperíodo\tde\t24\thoras,\ta\tanálise\tdos\t\ncompostos\t presentes\t nesse\tsistema\tpermitirá\ta\tdetecção\t\ndo\tisótopo\tno(a)\nA A água\tproduzida\tna\trespiração.\nB B piruvato produzido na glicólise.\nC C etanol\tproduzido\tna\tfermentação.\nAZ8*\nCN - 2° dia | Caderno 7 - AZUL - 2ª Aplicação 9\nENEM 2022 ENEM 2022 ENEM 2022 ENEM 2022 ENEM 2022 ENEM 2022 ENEM 2022 ENEM 2022 ENEM 2022 ENEM 2022 ENEM 2022 ENEM 2022 ENEM 2022 ENEM 2022 ENEM 2022 ENEM 2022 ENEM 2022 ENEM 2022 ENEM 2022 ENEM 2022 ENEM 2022 ENEM 2022 ENEM 2022 ENEM 2022 ENEM 2022 ENEM 2022 ENEM 2022 ENEM 2022 ENEM 2022 ENEM 2022 ENEM 2022 ENEM 2022 ENEM 2022 ENEM 2022 ENEM 2022 ENEM 2022 ENEM 2022 ENEM 2022 ENEM 2022 ENEM 2022 ENEM 2022 ENEM 2022 ENEM 2022 ENEM 2022 ENEM 2022 ENEM 2022 ENEM 2022 ENEM 2022 ENEM 2022 ENEM 2022 ENEM 2022 ENEM 2022 ENEM 2022 ENEM 2022 ENEM 2022 ENEM 2022 ENEM 2022 ENEM 2022 ENEM 2022 ENEM 2022 ENEM 2022 ENEM 2022 ENEM 2022",
            "pergunta": "Pergunta não detectada",
            "alternativas": {
                "A": "A água\tproduzida\tna\trespiração.",
                "B": "B piruvato produzido na glicólise.",
                "C": "C etanol\tproduzido\tna\tfermentação."
            },
            "bibliografia": "D D glicose produzida na fotossíntese.\nE E gás carbônico produzido no ciclo de Krebs.*020325"
        },
        {
            "numero": 117,
            "enunciado": "Diferentemente\t da\trespiração\t aeróbica,\t alguns\t\nmicrorganismos realizam processos catabólicos que \nlevam\tà\tobtenção\t de\tmoléculas\t orgânicas\t de\tinteresse\t\ncomercial, conforme ilustrado. O conhecimento dessas \nvias metabólicas é importante, por exemplo, para a \nfabricação\tde\tprodutos\talimentícios.\nFermentação alcoólic a\n(Levedura)\nCH O61 26\n(Glicose)\n2CHO343\n(Ácido pirúvico )\n2CO22 NADH\n2 NAD +\n2CHOH 25\n(Álcool etílico)\nExemplo: VinhoFermentação látic a\n(Lactobacilos)\nCH O61 26\n(Glicose)\n2CHO343\n(Ácido pirúvico)\n2CHO353\n(Ácido lático )2 NADH\n2 NAD +\nExemplo: Iogurte\nEsses\tprocessos\tde\tfermentação\ttêm\tem\tcomum\ta\nA A liberação\tde\tgases.\nB B descarboxilação\tdo\tácido.\nC C participação\tde\tprocariontes.\nD D oxidação\tcompleta\tdo\tsubstrato.\nE E formação\tde\tprodutos\tmetabolizáveis.",
            "pergunta": "Pergunta não detectada",
            "alternativas": {
                "A": "A liberação\tde\tgases.",
                "B": "B descarboxilação\tdo\tácido.",
                "C": "C participação\tde\tprocariontes.",
                "D": "D oxidação\tcompleta\tdo\tsubstrato.",
                "E": "E formação\tde\tprodutos\tmetabolizáveis."
            },
            "bibliografia": "Não Informada"
        },
        {
            "numero": 118,
            "enunciado": "No\tcircuito\telétrico,\t estão\tassociadas\t quatro\t\nlâmpadas\t elétricas\tidênticas\tA,\tB,\tC\te\tD.\tConsidere\t a\t\nfonte\tde\ttensão\t(V) ideal.\nA B\nC\nD\nV+\n−\nComparando-se\t o\tbrilho\tdas\tlâmpadas,\t se\ta\tlâmpada\tA\t\nqueimar,\tde\tmodo\tque\tnão\tpossa\tconduzir\tcorrente\telétrica,\t\nobserva-se\tque\nA A as\tlâmpadas\t B\te\tD\tapagam-se,\t e\tC\tpermanece\t acesa\t\ncom o mesmo brilho.\nB B a\tlâmpada\tB\tapaga-se,\t a\tC\tpermanece\t acesa\tcom\t\nmesmo brilho e D permanece apagada.\nC C a\tlâmpada\tB\tapaga-se,\t a\tC\tpermanece\t acesa\tcom\t\nmaior brilho e D permanece acesa com o mesmo \nbrilho.\nD D a\tlâmpada\tB\tapaga-se,\t a\tC\tpermanece\t acesa\tcom\t\no mesmo brilho e D permanece acesa com maior \nbrilho.\nE E as\tlâmpadas\t C\te\tD\tpermanecem\t acesas\tcom\to\t\nmesmo brilho e B permanece acesa com maior \nbrilho.*020325AZ9*\n10 \nCN - 2° dia | Caderno 7 - AZUL - 2ª Aplicação",
            "pergunta": "Pergunta não detectada",
            "alternativas": {
                "A": "A as\tlâmpadas\t B\te\tD\tapagam-se,\t e\tC\tpermanece\t acesa",
                "C": "C a\tlâmpada\tB\tapaga-se,\t a\tC\tpermanece\t acesa\tcom",
                "B": "B a\tlâmpada\tB\tapaga-se,\t a\tC\tpermanece\t acesa\tcom",
                "D": "D a\tlâmpada\tB\tapaga-se,\t a\tC\tpermanece\t acesa\tcom",
                "E": "E as\tlâmpadas\t C\te\tD\tpermanecem\t acesas\tcom\to"
            },
            "bibliografia": "Não Informada"
        },
        {
            "numero": 119,
            "enunciado": "Esteiras\te\tescadas\trolantes\tsão\tdispositivos\t que\tdeslocam, \ta\tvelocidade\t constante,\t os\tobjetos\tneles\tcolocados,\t\npor meio de sistemas de controle com sensores. Quando a massa total do dispositivo varia, seja pelo acréscimo ou \npela\tretirada\tde\tobjetos,\ta\tação\tde\tforças\timpulsivas\t mantém\ta\tvelocidade\t constante.\t Como\texemplo,\tconsidere\tque\t\na massa total diminua de 1 200 kg para 1 000 kg em um intervalo de tempo de 0,10 s, e que,\tentão,\tseja\taplicada\tuma\t\nforça impulsiva constante de 250 N para manter constante a velocidade.\nNo exemplo mencionado, o valor da velocidade constante do dispositivo rolante é, em m\ns,\nA A 0,011.\nB B 0,021.\nC C 0,025.\nD D 0,125.\nE E 0,500.",
            "pergunta": "Pergunta não detectada",
            "alternativas": {
                "A": "A 0,011.",
                "B": "B 0,021.",
                "C": "C 0,025.",
                "D": "D 0,125.",
                "E": "E 0,500."
            },
            "bibliografia": "Não Informada"
        },
        {
            "numero": 120,
            "enunciado": "A troposfera consiste basicamente em N2 e O2\tque,\tjuntos,\tcompreendem\t 99%\tda\tatmosfera\t da\tTerra.\tOutros\t\ngases, compreendidos como constituintes atmosféricos secundários, apesar de estarem presentes em concentrações \nmuito baixas, podem ter efeitos importantes ou danosos no meio ambiente. O quadro apresenta as principais fontes \ne concentrações típicas de alguns desses gases secundários.\nConstituinte secundário Principais fontes\nOzônio\t(O3)Descargas\telétricas;\tdifusão\tda\t\nestratosfera; névoa fotoquímica\nMetano\t(CH4)Decomposição\tde\tmatéria\torgânica;\t\nvazamento de gás natural\nDióxido\tde\tenxofre\t(SO2)Gases\tvulcânicos;\tincêndios\tfl\torestais;\t\nação\tde\tbactérias;\tqueima\tde\t\ncombustíveis fósseis; processos industriais\nMonóxido\tde\tcarbono\t(CO)Decomposição\tde\tmatéria\torgânica;\t\nprocessos industriais; queima de \ncombustíveis fósseis\nMonóxido\tde\tnitrogênio\t(NO)Descargas\telétricas;\tcombustão\tinterna\tde\t\nmotores;\tcombustão\tde\tmatéria\torgânica\t\nnitrogenada\n Pode-se\treduzir\tas\tconcentrações\t de\tum\tdesses\tconstituintes\t gasosos\tsecundários\t na\tatmosfera\t pela\tpassagem\t\ndos\tgases\tatravés\tde\tpurificadores\t químicos\tcontendo\t uma\tpasta\tde\tcalcário,\tcujo\tprincipal\tconstituinte\t é\to\tCaCO3, \nsendo\to\tgás\tremovido\tpor\tsua\tconversão\tem\tum\tsal\t(composto\tiônico\tsólido).\n\t(adaptado).\n\nA A Ozônio.\nB B Metano.\nC C Dióxido de enxofre.\nD D Monóxido de carbono.\nE E Monóxido de nitrogênio.*020325AZ10*\nCN - 2° dia | Caderno 7 - AZUL - 2ª Aplicação 11\nENEM 2022 ENEM 2022 ENEM 2022 ENEM 2022 ENEM 2022 ENEM 2022 ENEM 2022 ENEM 2022 ENEM 2022 ENEM 2022 ENEM 2022 ENEM 2022 ENEM 2022 ENEM 2022 ENEM 2022 ENEM 2022 ENEM 2022 ENEM 2022 ENEM 2022 ENEM 2022 ENEM 2022 ENEM 2022 ENEM 2022 ENEM 2022 ENEM 2022 ENEM 2022 ENEM 2022 ENEM 2022 ENEM 2022 ENEM 2022 ENEM 2022 ENEM 2022 ENEM 2022 ENEM 2022 ENEM 2022 ENEM 2022 ENEM 2022 ENEM 2022 ENEM 2022 ENEM 2022 ENEM 2022 ENEM 2022 ENEM 2022 ENEM 2022 ENEM 2022 ENEM 2022 ENEM 2022 ENEM 2022 ENEM 2022 ENEM 2022 ENEM 2022 ENEM 2022 ENEM 2022 ENEM 2022 ENEM 2022 ENEM 2022 ENEM 2022 ENEM 2022 ENEM 2022 ENEM 2022 ENEM 2022 ENEM 2022 ENEM 2022",
            "pergunta": "Entre\tos\tconstituintes\tsecundários\tapresentados,\tqual\tpode\tser\tremovido\tpela\tação\tdesse\tpurificador\tquímico?",
            "alternativas": {
                "A": "A Ozônio.",
                "B": "B Metano.",
                "C": "C Dióxido de enxofre.",
                "D": "D Monóxido de carbono.",
                "E": "E Monóxido de nitrogênio."
            },
            "bibliografia": "SPIRO, T. G.; STIGLIANI, W. M. Química ambiental.\tSão\tPaulo:\tPearson\tPrentice\tHall,\t2009\t(adaptado).\nBROWN, L.; LeMAY, H. E.; BURSTEN, B. E. Química: a ciência central.\tSão\tPaulo:\tPearson\tPrentice\tHall,\t2005"
        },
        {
            "numero": 121,
            "enunciado": "As\tusinas\tnucleares\t utilizam\to\tprincípio\tda\tfissão\t\nnuclear para gerar energia elétrica. Dentro do reator, \nnêutrons\tcolidem\tcom\tátomos\tde\turânio,\tque\tse\tdividem\t\nem dois novos átomos, liberando de dois a três nêutrons \ndo\tnúcleo,\tem\tuma\treação\tem\tcadeia.\tEsse\tprocesso\t\nlibera muito calor, que é utilizado para gerar energia. \nPorém, é necessário um sistema de arrefecimento para \nevitar\tuma\texplosão.\t Para\tisso,\ta\tágua\tcaptada\tde\tfontes\t\nnaturais circula em um sistema fechado e depois volta \npara o meio ambiente.\nCaso\tesse\tsistema\tnão\tocorra\tde\tmaneira\tadequada,\t\nserá gerado um impacto negativo porque\nA A produzirá gases tóxicos.\nB B diminuirá a reserva hídrica local.\nC C aquecerá os ecossistemas aquáticos.\nD D aumentará a disponibilidade de nutrientes.\nE E permitirá\ta\tcontaminação\tpor\tmicrorganismos.",
            "pergunta": "Pergunta não detectada",
            "alternativas": {
                "A": "A produzirá gases tóxicos.",
                "B": "B diminuirá a reserva hídrica local.",
                "C": "C aquecerá os ecossistemas aquáticos.",
                "D": "D aumentará a disponibilidade de nutrientes.",
                "E": "E permitirá\ta\tcontaminação\tpor\tmicrorganismos."
            },
            "bibliografia": "Não Informada"
        },
        {
            "numero": 122,
            "enunciado": "Com o objetivo de revestir o piso de uma rampa de \nacesso\tpara\tcadeiras\tde\trodas,\tdetermina-se\t que,\tsob\ta\t\naplicação\t de\tuma\tforça\tmotora\tde\taté\t200\tN,\tnão\tocorra\t\ndeslizamento\t dos\tpneus\tem\trelação\tà\tsuperfície\t de\t\ncontato.\tConsidera-se\t que\ta\tforça\tnormal\tque\tatua\tsobre\t\no conjunto cadeira e cadeirante é de 800 N.\nO quadro a seguir indica alguns materiais, seus \nrespectivos\t coeficientes\t de\tatrito\testático\tcom\ta\tborracha\t\ndos pneus e seus custos referentes ao metro quadrado \ninstalado.\t Cada\tcifrão\t($)\tindica\tuma\tunidade\tmonetária\t\ngenérica.\n\nA A Cimento.\nB B Mármore.\nC C Madeira.\nD D Carpete.\nE E Lona.",
            "pergunta": "RevestimentoCoefi  ciente de \natritoCusto do m2 \ninstalado\nCimento 0,20 $\nMármore 0,30 $$$$$\nMadeira 0,35 $$\nCarpete 0,45 $$$$\nLona 0,55 $$$\nQual revestimento apresenta o menor custo, além de \ngarantir que cadeiras de rodas passem pela rampa sem \nrisco\tde\tescorregamento?",
            "alternativas": {
                "A": "A Cimento.",
                "B": "B Mármore.",
                "C": "C Madeira.",
                "D": "D Carpete.",
                "E": "E Lona."
            },
            "bibliografia": "Não Informada"
        },
        {
            "numero": 123,
            "enunciado": "Os\tairbags\tde\tsegurança\t dos\tautomóveis\t são\t\nacionados com o impacto, que envia um sinal elétrico \npara\to\tdispositivo\t e\tinicia\ta\treação\texplosiva\t do\ttrinitreto\t\nde\tsódio\t(NaN3), produzindo sódio metálico e nitrogênio \nmolecular,\tconforme\ta\tequação:\n2 NaN3 (s)\t→\t2\tNa\t(s)\t+\t3\tN2 (g)\nO\tgás\tproduzido\t tem\tfunção\tde\tinflar\to\tairbag.\tEsse\ttipo\t\nde dispositivo contém, aproximadamente, 100 g de NaN3.\nConsidere: PV = nRT; P = 1 atm; T = 25 °C; \nR = 0,0821 Latm\nKmol⋅\n⋅; 0 °C = 273 K \nMassas molares: NaN3 = 65 g\nmol; N2 = 28 g\nmol; Na = 23 g\nmol\nNesse dispositivo, o volume de gás produzido, em litro, é\nA A 4,7.\nB B 9,4.\nC C 18,8.\nD D 56,5.\nE E 113,0.",
            "pergunta": "Pergunta não detectada",
            "alternativas": {
                "A": "A 4,7.",
                "B": "B 9,4.",
                "C": "C 18,8.",
                "D": "D 56,5.",
                "E": "E 113,0."
            },
            "bibliografia": "Não Informada"
        },
        {
            "numero": 124,
            "enunciado": "Uma prática que os brasileiros costumam realizar é \na\tdegustação\t de\tdoces\tem\tcompotas.\t O\tconhecimento\t\npopular\tindica\tque\tnão\té\taceitável\t deixar\to\tmesmo\t\ntalher\tusado\tna\tdegustação\t e\tlevado\tà\tboca\tdentro\t\nda compoteira aberta, em contato com o doce. Essa \nindicação\t se\tdeve\tao\tfato\tde\tque\to\tdoce,\tno\tpensamento\t\npopular, poderá azedar. \nEssa prática popular encontra respaldo no pensamento \ncientífico,\t uma\tvez\tque\to\tdoce\trealmente\t poderá\tazedar\t\nem\trazão\tda\nA A oxidação\tdo\tdoce\tpelo\tcontato\tcom\to\tar.\nB B contaminação\tpor\tmicrorganismos,\tque\tirão\tfermentá-lo.\nC C ação\tdas\tenzimas\tsalivares\t que\tforam\ttransferidas\t\npara\to\tdoce\tapós\ta\tdegustação.\nD D evaporação\t dos\tconservantes\t que\tmantêm\ta\tsolução\t\nda compota em equilíbrio químico.\nE E degradação\t dos\tcomponentes\t doces\tda\tcompota\tem\t\nreação\tcom\tcompostos\tquím icos do talher.*020325AZ11*\n12 \nCN - 2° dia | Caderno 7 - AZUL - 2ª Aplicação\nENEM 2022 ENEM 2022 ENEM 2022 ENEM 2022 ENEM 2022 ENEM 2022 ENEM 2022 ENEM 2022 ENEM 2022 ENEM 2022 ENEM 2022 ENEM 2022 ENEM 2022 ENEM 2022 ENEM 2022 ENEM 2022 ENEM 2022 ENEM 2022 ENEM 2022 ENEM 2022 ENEM 2022 ENEM 2022 ENEM 2022 ENEM 2022 ENEM 2022 ENEM 2022 ENEM 2022 ENEM 2022 ENEM 2022 ENEM 2022 ENEM 2022 ENEM 2022 ENEM 2022 ENEM 2022 ENEM 2022 ENEM 2022 ENEM 2022 ENEM 2022 ENEM 2022 ENEM 2022 ENEM 2022 ENEM 2022 ENEM 2022 ENEM 2022 ENEM 2022 ENEM 2022 ENEM 2022 ENEM 2022 ENEM 2022 ENEM 2022 ENEM 2022 ENEM 2022 ENEM 2022 ENEM 2022 ENEM 2022 ENEM 2022 ENEM 2022 ENEM 2022 ENEM 2022 ENEM 2022 ENEM 2022 ENEM 2022 ENEM 2022",
            "pergunta": "Pergunta não detectada",
            "alternativas": {
                "A": "A oxidação\tdo\tdoce\tpelo\tcontato\tcom\to\tar.",
                "B": "B contaminação\tpor\tmicrorganismos,\tque\tirão\tfermentá-lo.",
                "C": "C ação\tdas\tenzimas\tsalivares\t que\tforam\ttransferidas",
                "D": "D evaporação\t dos\tconservantes\t que\tmantêm\ta\tsolução",
                "E": "E degradação\t dos\tcomponentes\t doces\tda\tcompota\tem"
            },
            "bibliografia": "Não Informada"
        },
        {
            "numero": 125,
            "enunciado": "Dores\tabdominais,\t vômito\te\tdiarreia\tsão\tsintomas\tde\t\ndoença celíaca, uma síndrome autoimune hereditária que \nprovoca\tinflamação\t no\ttecido\tintestinal\tapós\ta\tingestão\t\nde glúten. O glúten é uma proteína presente em vegetais \ncomo o trigo, a cevada e o centeio. Uma pessoa com \nesses sintomas, que ingeriu arroz, bife com creme de leite, \nsalada de alface e tomate, lasanha e ovo cozido, após \nexames laboratoriais, foi diagnosticada como portadora \ndessa doença, o que gerou um encaminhamento médico \nnecessário.\n\nA A Arroz.\nB B Lasanha.\nC C Ovo cozido.\nD D Bife com creme de leite.\nE E Salada de alface e tomate.",
            "pergunta": "Qual dos alimentos ingeridos pela pessoa o médico \nprecisou\teliminar\tda\tdieta?",
            "alternativas": {
                "A": "A Arroz.",
                "B": "B Lasanha.",
                "C": "C Ovo cozido.",
                "D": "D Bife com creme de leite.",
                "E": "E Salada de alface e tomate."
            },
            "bibliografia": "Não Informada"
        },
        {
            "numero": 126,
            "enunciado": "A\tprimeira\trelação\tentre\tcâncer\te\tprodutos\t de\t\ncombustão\t data\tde\t1775,\trealizada\tna\tInglaterra,\t na\tqual\t\nfoi\tdescrita\ta\televada\tincidência\t de\tcâncer\tem\tjovens\t\nlimpadores de chaminés, os quais tinham contato diário \ncom\tfumaça\te\talcatrão.\tO\tbenzopireno\t (I) foi o primeiro \ncomposto\t carcinogênico\t isolado\tdo\talcatrão.\t Esse\t\nhidrocarboneto aromático policíclico é convertido, por \nmeio\tde\tuma\tbiotransformação,\t no\tcomposto\t (II), que é o \nreal\tcausador\tdo\tcâncer.\t\nOH\nOHO\nI II\n\t(adaptado).\nA\tbiotransformação\t do\tcomposto\t (I)\tem\t(II) corresponde \na\tuma\treação\tde\nA A adição.\nB B oxidação.\nC C eliminação.\nD D substituição.\nE E hidrogenação.",
            "pergunta": "Pergunta não detectada",
            "alternativas": {
                "A": "A adição.",
                "B": "B oxidação.",
                "C": "C eliminação.",
                "D": "D substituição.",
                "E": "E hidrogenação."
            },
            "bibliografia": "BARBOSA, L. C. A. Introdução à química orgânica . \nSão\tPaulo:\tPearson,\t2010"
        },
        {
            "numero": 127,
            "enunciado": "Detectores\t de\tfumaça\tbaseados\t em\tionização\t\nfuncionam como se fossem um “nariz eletrônico”, acusando \na\tpresença\t de\tmoléculas\t incomuns\t (fumaça)\t em\tseu\t\ninterior. Dentro do aparelho, conforme esquematizado na \nfigura,\texiste\tuma\tcâmara\tde\tionização\t aberta\tpara\to\tar\t\n(1)\te\tpreenchida\t com\tíons\t(2)\tformados\t pelos\tchoques\t\ndas moléculas do ar com as partículas emitidas pelo \nelemento químico amerício 95243Am\t(3).\tO\tamerício\texpele,\t\nno\tinterior\tda\tcâmara,\tpequenas\t partículas\t radioativas,\t\nchamadas\t partículas\talfa,\tque\tsão\tnúcleos\t de\tátomos\tde\t\n24He.\tCom\to\tchoque,\tsão\tformados\t cátions\te\telétrons,\t\nque transitam em direções opostas entre dois eletrodos. \nEnquanto houver cátions e elétrons se movendo no \ninterior\tda\tcâmara,\tuma\tcorrente\tse\testabelece\t entre\tos\t\neletrodos\t no\tcircuito\t(4)\te,\tpor\tse\tconsiderar\t que\ttudo\t\nestá\tbem,\to\talarme\t(5)\tpermanece\tem\tsilêncio.\nEntretanto, se um incêndio acontecer, partículas de \nfumaça\tentram\tno\tdetector\te\tcomeçam\t a\tobstruir\ta\tcâmara\t\nde\tionização\t (6).\tAs\tpartículas\t de\tfumaça\tse\tprendem\t\naos íons, e o circuito no detector acusa essa mudança \nimediatamente\t (7),\tacionando \to\talarme\t(8).\tAssim\tque\to\t\nincêndio\té\tcontrolado,\t e\ta\tfumaça\té\tremovida,\t a\tcâmara\t\nde\tdetecção\tfica\tlimpa,\tos\tíons\tvoltam\ta\tse\tdeslocar\tentre\t\nos eletrodos como antes, o circuito é desligado e o alarme \npara de tocar.\n1 234\n5\nFOGO!7\n8\n6\n\t(adaptado).\nO\tsensor\tpercebe\ta\tfumaça\tquando\tela\tinterrompe\to(a)\nA A fissão\tnuclear\tdo\tgás\thélio.\nB B passagem de corrente elétrica.\nC C transmutação\tdas\tmoléculas\tdo\tar.\nD D decaimento radioativo do amerício.\nE E fusão\tnuclear\tentre\to\thélio\te\to\tamerício.*020325AZ12*\n 13\nCN - 2° dia | Caderno 7 - AZUL - 2ª Aplicação",
            "pergunta": "Pergunta não detectada",
            "alternativas": {
                "A": "A fissão\tnuclear\tdo\tgás\thélio.",
                "B": "B passagem de corrente elétrica.",
                "C": "C transmutação\tdas\tmoléculas\tdo\tar.",
                "D": "D decaimento radioativo do amerício.",
                "E": "E fusão\tnuclear\tentre\to\thélio\te\to\tamerício."
            },
            "bibliografia": "Disponível\tem:\twww.explainthatstuff.com.\t Acesso\tem:\t3\tdez.\t2018"
        },
        {
            "numero": 128,
            "enunciado": "O audiograma corresponde a uma maneira objetiva de se representar a sensibilidade auditiva para diferentes \nfrequências sonoras. Quanto maior a sensibilidade, menor é a intensidade necessária para que o som seja detectado. \nNo\tgráfico,\tcada\tcurva\ttracejada\t corresponde\t a\tuma\tdeterminada\t porcentagem\t de\tuma\tmesma\tpopulação\t testada.\t\nA curva cheia superior corresponde aos níveis de intensidade sonora relatados como dolorosos.\n120Dor\n10099%\n95%\n90%\n75%\n50%\n25%\n10%\n5%Nível de intensidade sonora (dB)80\n60\n40\n20\n0\n20 40 100 200 400 1 000 2 000 4 000 10 000\nFrequência (Hz)\n\t(adaptado).\nA\tfaixa\tde\tfrequência,\tem\tHz,\tna\tqual\ta\tmaioria\tda\tpopulação\ttestada\ttem\tmaior\tsensibilidade\tauditiva,\tencontra-se\nA A abaixo de 80.\nB B entre 80 e 100.\nC C entre 2 000 e 4 000.\nD D entre 4 000 e 10 000.\nE E acima de 10 000.",
            "pergunta": "Pergunta não detectada",
            "alternativas": {
                "A": "A abaixo de 80.",
                "B": "B entre 80 e 100.",
                "C": "C entre 2 000 e 4 000.",
                "D": "D entre 4 000 e 10 000.",
                "E": "E acima de 10 000."
            },
            "bibliografia": "LENT, R. Cem bilhões de neurônios? \tConceitos\tfundamentais\tde\tneurociência.\tSão\tPaulo:\t Atheneu,\t2010"
        },
        {
            "numero": 129,
            "enunciado": "Os\tfabricantes\t de\tbebidas\tsó\tpodem\tchamar\tde\tsuco\tde\tfrutas\tos\tprodutos\tque\ttiverem\tcerca\tde\t50%\tde\tpolpa,\t\na\tparte\tcomestível\t da\tfruta.\tJá\to\tnéctar\tde\tfrutas,\tque\ttem\tadição\tde\taçúcar,\tpossui\tentre\t20%\te\t30%\tde\tpolpa\tde\t\nfrutas.\tO\tnúmero\tde\tcalorias\tdessas\tbebidas\té\tequivalente,\to\tque\tmuda\tsão\ta\tquantidade\te\ta\tqualidade\tdo\taçúcar.\n\t(adaptado).\nA qualidade e a quantidade de açúcares presentes nessas bebidas, de uma mesma fruta, diferem, pois\nA A há maior quantidade de frutose no suco e maior quantidade de sacarose no néctar.\nB B há maior quantidade de frutose no néctar e maior quantidade de sacarose no suco.\nC C há maior quantidade de sacarose no suco e quantidades iguais de frutose nos dois produtos.\nD D há maior quantidade de frutose no suco e quantidades iguais de sacarose nos dois produtos.\nE E há maior quantidade de frutose no néctar e quantidades iguais de saca rose nos dois produtos.*020325AZ13*\n14 \nCN - 2° dia | Caderno 7 - AZUL - 2ª Aplicação\nENEM 2022 ENEM 2022 ENEM 2022 ENEM 2022 ENEM 2022 ENEM 2022 ENEM 2022 ENEM 2022 ENEM 2022 ENEM 2022 ENEM 2022 ENEM 2022 ENEM 2022 ENEM 2022 ENEM 2022 ENEM 2022 ENEM 2022 ENEM 2022 ENEM 2022 ENEM 2022 ENEM 2022 ENEM 2022 ENEM 2022 ENEM 2022 ENEM 2022 ENEM 2022 ENEM 2022 ENEM 2022 ENEM 2022 ENEM 2022 ENEM 2022 ENEM 2022 ENEM 2022 ENEM 2022 ENEM 2022 ENEM 2022 ENEM 2022 ENEM 2022 ENEM 2022 ENEM 2022 ENEM 2022 ENEM 2022 ENEM 2022 ENEM 2022 ENEM 2022 ENEM 2022 ENEM 2022 ENEM 2022 ENEM 2022 ENEM 2022 ENEM 2022 ENEM 2022 ENEM 2022 ENEM 2022 ENEM 2022 ENEM 2022 ENEM 2022 ENEM 2022 ENEM 2022 ENEM 2022 ENEM 2022 ENEM 2022 ENEM 2022",
            "pergunta": "Pergunta não detectada",
            "alternativas": {
                "A": "A há maior quantidade de frutose no suco e maior quantidade de sacarose no néctar.",
                "B": "B há maior quantidade de frutose no néctar e maior quantidade de sacarose no suco.",
                "C": "C há maior quantidade de sacarose no suco e quantidades iguais de frutose nos dois produtos.",
                "D": "D há maior quantidade de frutose no suco e quantidades iguais de sacarose nos dois produtos.",
                "E": "E há maior quantidade de frutose no néctar e quantidades iguais de saca rose nos dois produtos."
            },
            "bibliografia": "Revista Super.\tDisponível\tem:\thttp://super.abril.com.br.\t Acesso\tem:\t28\tfev.\t2012"
        },
        {
            "numero": 130,
            "enunciado": "O esquema representa alguns passos de uma série \nde reações metabólicas transformando o aminoácido \nfenilalanina\t em\tquatro\tpossíveis\t substâncias.\t Essas\t\nreações\tenzimáticas\t são\tresultado\t da\texpressão\t de\t\nalelos dominantes A, B, C e D.\n\nA A Taquicardia.\nB B Retardo mental.\nC C Redução\tde\tpeso.\nD D Ausência\tde\tpigmentação\tna\tpele.\nE E Disfunção\tdos\tprocessos\tmetabólicos.",
            "pergunta": "FENILALANINA\nTIROSINA\nADRENALINA MELANINA\nTIROXINAAlelo C → enzima E3Alelo B → enzima E2Alelo A → enzima E1\nAlelo D →  enzima E4\nQual o resultado metabólico de uma criança recessiva \npara\to\tpar\tde\talelos\tB?",
            "alternativas": {
                "A": "A Taquicardia.",
                "B": "B Retardo mental.",
                "C": "C Redução\tde\tpeso.",
                "D": "D Ausência\tde\tpigmentação\tna\tpele.",
                "E": "E Disfunção\tdos\tprocessos\tmetabólicos."
            },
            "bibliografia": "Não Informada"
        },
        {
            "numero": 131,
            "enunciado": "Estudos apontam que o meteorito que atingiu o céu \nda Rússia em fevereiro de 2013 liberou uma energia \nequivalente\t a\t500\tquilotoneladas\t de\tTNT\t(trinitrotolueno),\t\ncerca de 30 vezes mais forte que a bomba atômica \nlançada\tpelos\tEstados\tUnidos\tem\tHiroshima,\t no\tJapão,\t\nem 1945. Os cálculos estimam que o meteorito estava a \n19 quilômetros por segundo no momento em que atingiu \na atmosfera e que seu brilho era 30 vezes mais intenso \ndo que o brilho do Sol.\nA energia liberada pelo meteorito ao entrar na atmosfera \nterrestre é proveniente, principalmente,\nA A da queima de combustíveis contidos no meteorito.\nB B de reações nucleares semelhantes às que ocorrem \nno Sol.\nC C da energia cinética associada à grande velocidade do \nmeteorito.\nD D de reações semelhantes às que ocorrem em \nexplosões nucleares.\nE E da queima da grande quantidade de trinitrotolueno \npresente no meteorito.",
            "pergunta": "Pergunta não detectada",
            "alternativas": {
                "A": "A da queima de combustíveis contidos no meteorito.",
                "B": "B de reações nucleares semelhantes às que ocorrem",
                "C": "C da energia cinética associada à grande velocidade do",
                "D": "D de reações semelhantes às que ocorrem em",
                "E": "E da queima da grande quantidade de trinitrotolueno"
            },
            "bibliografia": "Não Informada"
        },
        {
            "numero": 132,
            "enunciado": "As\tfiguras\tmostram\tdois\texperimentos.\t No\tprimeiro,\t\nforam colocados em um frasco e agitados com uma \ncolher volumes iguais de mel, água, óleo e álcool etílico. \nApós\talguns\tminutos,\tpodia-se\tverificar\tque\to\tsistema\t\ntinha\tduas\tfases\t(1).\tNo\tsegundo\texperimento,\t foram\t\ncolocados,\t lentamente\t e\tsem\tagitação,\t os\tmesmos\t\nvolumes\tde\tmel,\tágua,\tóleo\te\tálcool\tetílico.\tPôde-se\t\nobservar\t que,\tdependendo\t da\tordem\tde\tadição\tde\t\ncada componente, o sistema permaneceu com quatro \nfases\t(2).\n(1) (2)\nAs\tpropriedades\t de\tlíquidos\te\tsoluções\tque\tjustificam\t os\t\nresultados\tobtidos\tnos\texperimentos\t1\te\t2\tsão\nA A solubilidade e densidade.\nB B densidade e viscosidade.\nC C viscosidade e solubilidade.\nD D miscibilidade e viscosidade.\nE E solubilidade e miscibilidade.",
            "pergunta": "Pergunta não detectada",
            "alternativas": {
                "A": "A solubilidade e densidade.",
                "B": "B densidade e viscosidade.",
                "C": "C viscosidade e solubilidade.",
                "D": "D miscibilidade e viscosidade.",
                "E": "E solubilidade e miscibilidade."
            },
            "bibliografia": "Não Informada"
        },
        {
            "numero": 133,
            "enunciado": "Uma\tintervenção\t no\tmeio\tambiente\t tem\tinquietado\t\nmuitos pesquisadores que consideram um risco reviver \numa\tespécie\textinta.\tOs\tenvolvidos\t são\tos\tmamutes,\t\npaquidermes peludos extintos há milhares de anos. Em \ncadáveres de mamutes recuperados de locais como \na\tSibéria,\testão\tsendo\tconduzidas\t buscas\tpor\tcélulas\t\nsomáticas com núcleos viáveis para, posteriormente, \nser\ttentada\ta\tsua\tinserção\tem\tzigotos\tanucleados\t de\t\nelefantes.\n\t(adaptado).\nO método citado é denominado clonagem embrionária \nporque\nA A permite\ta\tcriação\tde\thíbridos.\nB B depende\tda\treprodução\tassistida.\nC C leva\tà\tformação\tde\tuma\tnova\tespécie.\nD D gera embriões cromossomicamente idênticos ao \nparental.\nE E está associado com transferência de genes entre \nespécies.*020325AZ14*\n 15\nCN - 2° dia | Caderno 7 - AZUL - 2ª Aplicação",
            "pergunta": "Pergunta não detectada",
            "alternativas": {
                "A": "A permite\ta\tcriação\tde\thíbridos.",
                "B": "B depende\tda\treprodução\tassistida.",
                "C": "C leva\tà\tformação\tde\tuma\tnova\tespécie.",
                "D": "D gera embriões cromossomicamente idênticos ao",
                "E": "E está associado com transferência de genes entre"
            },
            "bibliografia": "COOPER, A. The Year of Mammoth. PLoS Biol ,\tn.\t3,\tmar.\t2006"
        },
        {
            "numero": 134,
            "enunciado": "O\tpalmito\tjuçara\t(Euterpe edulis )\té\tuma\tplanta\tque\tocorre\tem\táreas\tflorestadas\t e\tproduz\tfrutos\tcom\ttamanhos\t\nvariados. Entretanto, pesquisadores perceberam que, em áreas nas quais as aves de maior porte foram extintas, as \nnovas plantas produzem apenas frutos pequenos.\n\t(adaptado).\nEssa\tmudança\tapresentada\tpelas\tplantas\té\tuma\tadaptação\tvantajosa\tporque\tos\tfrutos\nA A atraem\taves\tde\tpequeno\tporte,\tgarantindo\ta\tingestão\tdos\tfrutos.\nB B são\ttransportados\tpelo\tvento,\taumentando\ta\tdispersão\tde\tsementes.\nC C facilitam\ta\tdesidratação\tdas\tsementes,\tprolongando\tsua\tdurabilidade\tno\tsolo.\nD D aceleram\ta\tgerminação\tdas\tsementes,\tfavorecendo\ta\tcolonização\tde\toutras\táreas.\nE E armazenam menor quantidade de fotoassimilados, mantendo as reservas da planta.",
            "pergunta": "Pergunta não detectada",
            "alternativas": {
                "A": "A atraem\taves\tde\tpequeno\tporte,\tgarantindo\ta\tingestão\tdos\tfrutos.",
                "B": "B são\ttransportados\tpelo\tvento,\taumentando\ta\tdispersão\tde\tsementes.",
                "C": "C facilitam\ta\tdesidratação\tdas\tsementes,\tprolongando\tsua\tdurabilidade\tno\tsolo.",
                "D": "D aceleram\ta\tgerminação\tdas\tsementes,\tfavorecendo\ta\tcolonização\tde\toutras\táreas.",
                "E": "E armazenam menor quantidade de fotoassimilados, mantendo as reservas da planta."
            },
            "bibliografia": "ANDRADE, R. O. Escassez de aves pode afetar evolução de plantas .\tDisponível\tem:\thttp://revistapesquisa.fapesp.br.\t Acesso\tem:\t8\tjul.\t2013"
        },
        {
            "numero": 135,
            "enunciado": "Para\treduzir\ta\tpoluição\tatmosférica\t gerada\tpela\temissão\tde\tfumaça\tpor\tgrandes\tindústrias,\t utilizam-se\t\nprecipitadores\t eletrostáticos.\t Sua\tfunção\té\tsuprimir\tos\tgases\tpoluentes\t antes\tque\tsejam\tlançados\tpara\ta\tatmosfera.\t\nA\tfigura\tilustra\tum\tprecipitador\t constituído,\t basicamente,\t por\tuma\tentrada\te\tuma\tsaída\tde\tgases\te\tpor\tum\tfio\tgrosso\t\nde\tcobre,\tconectado\t a\tuma\tfonte\tde\ttensão.\tO\tacúmulo\tde\tcargas\tno\tfio\tde\tcobre\tinduz\ta\tpolarização\t das\tpartículas\t\npoluentes.\t Os\tgases\tpoluídos\tsão\tinjetados\t pela\tentrada\tde\tgases,\te\tos\tgases\tsem\tpoluentes\t são\tlançados\t na\t\natmosfera pela saída do precipitador.\nSaída de\ngases\nEntrada\nde gases+\nNo\tprecipitador\teletrostático,\tas\tpartículas\tpoluentes\tsão\nA A atraídas\te\tse\tacumulam\tno\tfio\tcarregado.\nB B decompostas\tem\tmoléculas\tnão\tpoluentes.\nC C ionizadas e podem ser lançadas na atmosfera.\nAZ15*\n16 \nMT - 2° dia | Caderno 7 - AZUL - 2ª Aplicação\nENEM 2022 ENEM 2022 ENEM 2022 ENEM 2022 ENEM 2022 ENEM 2022 ENEM 2022 ENEM 2022 ENEM 2022 ENEM 2022 ENEM 2022 ENEM 2022 ENEM 2022 ENEM 2022 ENEM 2022 ENEM 2022 ENEM 2022 ENEM 2022 ENEM 2022 ENEM 2022 ENEM 2022 ENEM 2022 ENEM 2022 ENEM 2022 ENEM 2022 ENEM 2022 ENEM 2022 ENEM 2022 ENEM 2022 ENEM 2022 ENEM 2022 ENEM 2022 ENEM 2022 ENEM 2022 ENEM 2022 ENEM 2022 ENEM 2022 ENEM 2022 ENEM 2022 ENEM 2022 ENEM 2022 ENEM 2022 ENEM 2022 ENEM 2022 ENEM 2022 ENEM 2022 ENEM 2022 ENEM 2022 ENEM 2022 ENEM 2022 ENEM 2022 ENEM 2022 ENEM 2022 ENEM 2022 ENEM 2022 ENEM 2022 ENEM 2022 ENEM 2022 ENEM 2022 ENEM 2022 ENEM 2022 ENEM 2022 ENEM 2022MATEMÁTICA E SUAS TECNOLOGIAS",
            "pergunta": "Pergunta não detectada",
            "alternativas": {
                "A": "A atraídas\te\tse\tacumulam\tno\tfio\tcarregado.",
                "B": "B decompostas\tem\tmoléculas\tnão\tpoluentes.",
                "C": "C ionizadas e podem ser lançadas na atmosfera."
            },
            "bibliografia": "D D repelidas\tpelo\tfio\tcarregado\te\tse\tacumulam\tna\tparede\tdo\ttubo.\nE E induzidas\ta\tfazer\tligações\tiônicas,\tformando\tíons\tnão\tpoluentes.*020325"
        }
    ],
    "MATEMÁTICA E SUAS TECNOLOGIAS": [
        {
            "numero": 136,
            "enunciado": "Uma faculdade oferece dois cursos diferentes na área \nde Humanas. Para um aluno ingressar nesses cursos, o \nvestibular\t contém\tquestões\t objetivas\te\tuma\tredação,\t e\ta\t\nnota\tfinal\tdo\tcandidato\t é\ta\tsoma\tdessas\tnotas,\tutilizando\t\no seguinte critério de pesos:\n• questões objetivas: peso 1 para o curso I e  \npeso 1 para o curso II;\n• redação:\tpeso\t2\tpara\to\tcurso\tI\te\tpeso\t3\tpara\to\t\ncurso II.\nUm candidato que concorre aos dois cursos obteve \nnota X nas questões objetivas e nota Y \tna\tredação.\t\nPara analisar sua nota para o curso I e para o curso II, \no candidato representa sua nota com um produto de \nmatrizes A . B, em que a matriz A representa os pesos, \ne a matriz B contém as notas obtidas pelo candidato.  \nA matriz resultante A . B é uma matriz coluna, em que, \nna\tprimeira\tlinha,\ttem\tsua\tnota\tfinal\tpara\to\tcurso\tI\te,\tna \t\nsegunda\tlinha,\ttem\tsua\tnota\tfinal\tpara\to\tcurso\tII.\n\nA A 11\n23/g167\n/g169/g168/g183\n/g185/g184/g167\n/g169/g168/g183\n/g185/g184 /g3/g3/g120/g120X\nY\nB B 12\n13/g167\n/g169/g168/g183\n/g185/g184/g167\n/g169/g168/g183\n/g185/g184 /g3/g3/g120/g120X\nY\nC C 21\n31/g167\n/g169/g168/g183\n/g185/g184/g167\n/g169/g168/g183\n/g185/g184 /g3/g3/g120/g120X\nY\nD D 23\n11/g167\n/g169/g168/g183\n/g185/g184/g167\n/g169/g168/g183\n/g185/g184 /g3/g3/g120/g120Y\nX\nE E 11\n23/g167\n/g169/g168/g183\n/g185/g184/g167\n/g169/g168/g183\n/g185/g184 /g3/g3/g120/g120Y\nX",
            "pergunta": "Nessas\tcondições,\t qual\trepresentação\t algébrica\t gera\to\t\nresultado\tfinal\tdesse\tcandidato\tnos\tdois\tcursos?",
            "alternativas": {
                "A": "A 11",
                "B": "B 12",
                "C": "C 21",
                "D": "D 23",
                "E": "E 11"
            },
            "bibliografia": "Não Informada"
        },
        {
            "numero": 137,
            "enunciado": "Os aeroportos apresentam regras rígidas para \ndespacho de bagagem. No caso de embarque nacional, \nalgumas\tcompanhias\t aéreas\tainda\tnão\tcobravam,\t até\t\n2017, por unidade de bagagem despachada, limitada a \n23 kg por passageiro. \nUma pessoa irá viajar com uma única mala. Como \nnão\tquer\tpagar\tpor\t“excesso\t de\tpeso”\te\tdispõe,\tem\t\ncasa, de uma balança de pêndulo que apresenta um erro \nmáximo\tde\t8%\ta\tmais\tem\trelação\tà\tmassa\treal\tdo\tobjeto\t\nque\tnela\tfor\tverificada,\t conferirá\tqual\ta\tmassa\tde\tsua\t\nmala antes de ir para o aeroporto.\nO valor máximo, em quilograma, indicado em sua balança \ndeverá ser\nA A 21,16.\nB B 22,08.\nC C 23,92.\nD D 24,84.\nE E 25,00.",
            "pergunta": "Pergunta não detectada",
            "alternativas": {
                "A": "A 21,16.",
                "B": "B 22,08.",
                "C": "C 23,92.",
                "D": "D 24,84.",
                "E": "E 25,00."
            },
            "bibliografia": "Não Informada"
        },
        {
            "numero": 138,
            "enunciado": "O diabetes mellitus  é uma doença crônica, \ncaracterizada pelo aumento de glicose no sangue.  \nO Sistema de Cadastramento e Acompanhamento de \nHipertensos\t e\tDiabéticos\t destina-se\t ao\tcadastramento\t e\t\nacompanhamento\t de\tportadores\t de\thipertensão\t arterial\t\ne/ou diabetes  mellitus atendidos na rede ambulatorial do \nSistema Único de Saúde. A tabela mostra o número de \npessoas portadoras de  diabetes mellitus  tipo 2, a forma \nmais grave da doença, distribuídas pelas macrorregiões \nde saúde de Minas Gerais, em 2012.\nMacrorregião\nde saúdeNúmero de portadores \nde diabetes mellitus\ntipo 2\nSul 714\nCentro-Sul 186\nCentro 448\nJequitinhonha 36\nOeste 460\nLeste 255\nSudeste 110\nNorte 45\nNoroeste 86\nLeste do Sul 47\nNordeste 39\nTriângulo\tdo\tSul 153\nTriângulo\tdo\tNorte 128\n.\nA mediana do número de portadores de diabetes mellitus  \ntipo 2 das macrorregiões de saúde de Minas Gerais é\nA A 110,00.\nB B 119,00.\nC C 128,00.\nD D 182,50.\nE E 208,23.*020325AZ16*\n 17\nMT - 2° dia | Caderno 7 - AZUL - 2ª Aplicação\nENEM 2022 ENEM 2022 ENEM 2022 ENEM 2022 ENEM 2022 ENEM 2022 ENEM 2022 ENEM 2022 ENEM 2022 ENEM 2022 ENEM 2022 ENEM 2022 ENEM 2022 ENEM 2022 ENEM 2022 ENEM 2022 ENEM 2022 ENEM 2022 ENEM 2022 ENEM 2022 ENEM 2022 ENEM 2022 ENEM 2022 ENEM 2022 ENEM 2022 ENEM 2022 ENEM 2022 ENEM 2022 ENEM 2022 ENEM 2022 ENEM 2022 ENEM 2022 ENEM 2022 ENEM 2022 ENEM 2022 ENEM 2022 ENEM 2022 ENEM 2022 ENEM 2022 ENEM 2022 ENEM 2022 ENEM 2022 ENEM 2022 ENEM 2022 ENEM 2022 ENEM 2022 ENEM 2022 ENEM 2022 ENEM 2022 ENEM 2022 ENEM 2022 ENEM 2022 ENEM 2022 ENEM 2022 ENEM 2022 ENEM 2022 ENEM 2022 ENEM 2022 ENEM 2022 ENEM 2022 ENEM 2022 ENEM 2022 ENEM 2022",
            "pergunta": "Pergunta não detectada",
            "alternativas": {
                "A": "A 110,00.",
                "B": "B 119,00.",
                "C": "C 128,00.",
                "D": "D 182,50.",
                "E": "E 208,23."
            },
            "bibliografia": "Disponível em: http://tabnet.datasus.gov.br. Acesso em: 5 nov. 2017"
        },
        {
            "numero": 139,
            "enunciado": "A\tclassificação\t de\tum\tpaís\tno\tquadro\tde\tmedalhas \t\nolímpicas\t deve-se\tprimeiro\tao\tnúmero\tde\tmedalhas\t de\t\nouro que o país conquistou. Em caso de empate no \nnúmero de medalhas de ouro, passa a ser considerado \no\tnúmero\tde\tmedalhas\t de\tprata\te,\tpor\tfim,\to\tde\t\nmedalhas de bronze. O quadro de medalhas a seguir \napresenta\t os\tpaíses\tclassificados\t do\t9º ao 11º  lugar \nnas Olimpíadas de Londres, realizadas em 2012.\nOuro Prata Bronze\n9º Hungria 8 4 5\n10º Austrália 7 16 12\n11º\tJapão 7 14 17\nNessa olimpíada, o Brasil obteve 3 medalhas de ouro, \n5\tde\tprata\te\t9\tde\tbronze,\tclassificando-se\t em\t22º lugar \nno quadro geral de medalhas.\n\t(adaptado).\n\nA A 22\nB B 19\nC C 17\nD D 16\nE E 14",
            "pergunta": "Supondo que o número de medalhas dos demais \npaíses permaneça inalterado, qual o número mínimo de \nmedalhas que o Brasil deveria ter ganhado a mais nas \nOlimpíadas\t de\tLondres\ta\tfim\tde\tficar\texatamente\t na\t \n10ª\tposição?",
            "alternativas": {
                "A": "A 22",
                "B": "B 19",
                "C": "C 17",
                "D": "D 16",
                "E": "E 14"
            },
            "bibliografia": "Disponível\tem:\thttp://olimpiadas.uol.com.br.\t Acesso\tem:\t28\tfev.\t2013"
        },
        {
            "numero": 140,
            "enunciado": "A\tassociação\t de\tcomerciantes\t varejistas\t de\tuma\t\ncidade,\ta\tfim\tde\tincrementar\t as\tvendas\tpara\to\tNatal,\t\ndecidiu\tpromover\t um\tfim\tde\tsemana\tde\tdescontos\t e\t\npromoções, no qual produtos e serviços estariam  com \nvalores reduzidos. Antes do período promocional, um \ncelular\tcustava\tR$\t300,00\te\tteve\tseu\tpreço\treajustado,\t\npassando\t a\tcustar\tR$\t315,00.\tDurante\to\tfim\tde\tsemana\t\nde descontos e promoções, o preço desse celular recebeu \num\tdesconto\tde\t20%.\nO desconto dado no preço do celular, em porcentagem, \ncom base no valor dele anteriormente ao aumento sofrido \nantes\tda\tpromoção,\tfoi\tde\nA A 15,24%\nB B 16,00%\nC C 19,04%\nD D 21,00%\nE E 25,00%",
            "pergunta": "Pergunta não detectada",
            "alternativas": {
                "A": "A 15,24%",
                "B": "B 16,00%",
                "C": "C 19,04%",
                "D": "D 21,00%",
                "E": "E 25,00%"
            },
            "bibliografia": "Não Informada"
        },
        {
            "numero": 141,
            "enunciado": "Uma\tindústria\tplaneja\tproduzir\tcaixa-d’água,\t em\t\nformato cilíndrico, com 1 m de altura, capaz de armazenar \n0,4 m³ de água.\nA\tmedida\tdo\traio\tda\tbase\tdessa\tcaixa-d’água,\t em\tmetro,\t\ndeve ser\nA A 02,\nπ\nB B 04,\nπ\nC C 02,\nπ\nD D 04,\nπ\nE E 12,\nπ",
            "pergunta": "Pergunta não detectada",
            "alternativas": {
                "A": "A 02,",
                "B": "B 04,",
                "C": "C 02,",
                "D": "D 04,",
                "E": "E 12,"
            },
            "bibliografia": "Não Informada"
        },
        {
            "numero": 142,
            "enunciado": "Sete países americanos, Argentina, Brasil, Canadá, \nChile, Estados Unidos, Paraguai e Uruguai; e sete países \neuropeus, Portugal, Espanha, França, Inglaterra, Itália, \nAlemanha\t e\tSuíça,\tdecidem\tcriar\tuma\tcomissão\t com\t\nrepresentantes de oito desses países, objetivando criar \npolíticas\tde\tincentivo\te\tregulação\t do\tturismo\tentre\teles.\t\nNa\thipótese\tde\tcriação\tda\tcomissão,\t serão\tescolhidos\t\naleatoriamente quatro representantes de países das \nAméricas e quatro representantes de países europeus, \nnão\tpodendo\testar\tna\tcomissão\t dois\trepresentantes\t de\t\num mesmo país.\n\nA A 1\n182\nB B 1\n49\nC C 1\n4\nD D 1\n13\nE E 16\n49\n *020325AZ17*\n18 \nMT - 2° dia | Caderno 7 - AZUL - 2ª Aplicação\nENEM 2022 ENEM 2022 ENEM 2022 ENEM 2022 ENEM 2022 ENEM 2022 ENEM 2022 ENEM 2022 ENEM 2022 ENEM 2022 ENEM 2022 ENEM 2022 ENEM 2022 ENEM 2022 ENEM 2022 ENEM 2022 ENEM 2022 ENEM 2022 ENEM 2022 ENEM 2022 ENEM 2022 ENEM 2022 ENEM 2022 ENEM 2022 ENEM 2022 ENEM 2022 ENEM 2022 ENEM 2022 ENEM 2022 ENEM 2022 ENEM 2022 ENEM 2022 ENEM 2022 ENEM 2022 ENEM 2022 ENEM 2022 ENEM 2022 ENEM 2022 ENEM 2022 ENEM 2022 ENEM 2022 ENEM 2022 ENEM 2022 ENEM 2022 ENEM 2022 ENEM 2022 ENEM 2022 ENEM 2022 ENEM 2022 ENEM 2022 ENEM 2022 ENEM 2022 ENEM 2022 ENEM 2022 ENEM 2022 ENEM 2022 ENEM 2022 ENEM 2022 ENEM 2022 ENEM 2022 ENEM 2022 ENEM 2022 ENEM 2022",
            "pergunta": "Qual é a probabilidade de o Brasil e a França pertencerem \na\tessa\tcomissão?",
            "alternativas": {
                "A": "A 1",
                "B": "B 1",
                "C": "C 1",
                "D": "D 1",
                "E": "E 16"
            },
            "bibliografia": "Não Informada"
        },
        {
            "numero": 143,
            "enunciado": "Um curso preparatório para concursos tem duas \nturmas,\tA\te\tB.\tDo\ttotal\tde\talunos,\t54%\testão\tna\t \nturma\tA.\tA\tdireção\tdo\tcurso\tdecidiu\tpagar\tum\tbônus\t\nsalarial aos professores dessas turmas, de acordo com \na probabilidade de um aluno do curso, escolhido ao \nacaso, ser aprovado no concurso. Foi estabelecida a \ntabela\tque\tindica\tcomo\to\tbônus\tseria\tdefinido.\nProbabilidade de aprovação ( %) Bônus\n0 < P < 10 I\n10 < P < 20 II\n20 < P < 35 III\n35 < P < 50 IV\n50 < P < 100 V\n Para calcular a probabilidade desejada, foi aplicado \num simulado anterior ao concurso. Nele, o percentual de \naprovados\t da\tturma\tA\tfoi\tde\t25%,\tenquanto\t houve\tuma\t\naprovação\tde\t40%\tpara\tos\talunos\tda\tturma\tB.\nDessa forma, os professores desse curso devem receber \no bônus \nA A I.\nB B II.\nC C III.\nD D IV.\nE E V",
            "pergunta": "Pergunta não detectada",
            "alternativas": {
                "A": "A I.",
                "B": "B II.",
                "C": "C III.",
                "D": "D IV.",
                "E": "E V"
            },
            "bibliografia": "Não Informada"
        },
        {
            "numero": 144,
            "enunciado": "Admita que um grupo musical deseja produzir \nseu próprio CD. Para tanto, adquire um pequeno \nequipamento\t para\tgravar\tCDs\tao\tvalor\tde\tR$\t252,00,\t\ne vários CDs novos, sendo esses os únicos gastos \nrealizados\t na\tprodução\t dos\tCDs.\tSabe-se\tque\to\tcusto\t\ntotal na compra do equipamento e dos CDs totalizou o \nvalor\tde\tR$\t1\t008,00,\te\tque\to\tcusto\tunitário\tde\tcada\tCD\t\nnovo, em real, varia de acordo com o número n de CDs \nadquiridos, segundo o quadro.\nNúmero n de CDs \nadquiridos Custo unitário de cada \nCD novo (em real)\nn < 1 000 0,45\n1 000 < n < 2 500 0,40\n2 500 < n 0,35\nNessas condições, o número de CDs adquiridos pelo \ngrupo musical é igual a\nA A 1 680.\nB B 1 890.\nC C 2 160.\nD D 2 520.\nE E 2 880.",
            "pergunta": "Pergunta não detectada",
            "alternativas": {
                "A": "A 1 680.",
                "B": "B 1 890.",
                "C": "C 2 160.",
                "D": "D 2 520.",
                "E": "E 2 880."
            },
            "bibliografia": "Não Informada"
        },
        {
            "numero": 145,
            "enunciado": "Um cliente vai a uma loja de materiais de revestimento \ncerâmico\tpara\tadquirir\tporcelanato\t para\ta\tsubstituição\t do\t\npiso de uma sala com formato retangular, com área total \nde 36 m2. O vendedor dessa loja lhe oferece dois projetos.\n• Projeto A: porcelanato quadrado, com 0,60 m de \nlado, para ser disposto de maneira que a diagonal \ndo quadrado seja paralela ao contorno da sala. \nCusto\tda\tcaixa\tcom\t10\tpeças:\tR$\t60,00.\n• Projeto B: porcelanato quadrado, com 0,40 m de \nlado, para ser disposto de maneira que os lados \ndo quadrado sejam paralelos ao contorno da sala. \nCusto\tda\tcaixa\tcom\t12\tpeças:\tR$\t40,00.\nO vendedor informa que a fábrica recomenda a \ncompra de uma quantidade adicional do número de peças \npara eventual necessidade de cortes e para reserva. No \ncaso\tdo\tprojeto\tA,\tdevem\tser\tadquiridos\t 25%\ta\tmais,\te\t\nno\tcaso\tdo\tprojeto\tB,\t uma\tquantidade\t 10%\tmaior\tdo\tque\t\no valor exato da área de recobrimento.\nO\tcliente\tdecide,\tentão,\tque\tirá\tadotar\to\tprojeto\tde\t\nmenor custo.\nO custo mínimo que o cliente deverá ter, em conformidade \ncom seu objetivo e com as informações apresentadas, \nserá de\nA A R$\t600,00.\nB B R$\t660,00.\nC C R$\t720,00.\nAZ18*\n 19\nMT - 2° dia | Caderno 7 - AZUL - 2ª Aplicação\nENEM 2022 ENEM 2022 ENEM 2022 ENEM 2022 ENEM 2022 ENEM 2022 ENEM 2022 ENEM 2022 ENEM 2022 ENEM 2022 ENEM 2022 ENEM 2022 ENEM 2022 ENEM 2022 ENEM 2022 ENEM 2022 ENEM 2022 ENEM 2022 ENEM 2022 ENEM 2022 ENEM 2022 ENEM 2022 ENEM 2022 ENEM 2022 ENEM 2022 ENEM 2022 ENEM 2022 ENEM 2022 ENEM 2022 ENEM 2022 ENEM 2022 ENEM 2022 ENEM 2022 ENEM 2022 ENEM 2022 ENEM 2022 ENEM 2022 ENEM 2022 ENEM 2022 ENEM 2022 ENEM 2022 ENEM 2022 ENEM 2022 ENEM 2022 ENEM 2022 ENEM 2022 ENEM 2022 ENEM 2022 ENEM 2022 ENEM 2022 ENEM 2022 ENEM 2022 ENEM 2022 ENEM 2022 ENEM 2022 ENEM 2022 ENEM 2022 ENEM 2022 ENEM 2022 ENEM 2022 ENEM 2022 ENEM 2022 ENEM 2022",
            "pergunta": "Pergunta não detectada",
            "alternativas": {
                "A": "A R$\t600,00.",
                "B": "B R$\t660,00.",
                "C": "C R$\t720,00."
            },
            "bibliografia": "D D R$\t780,00.\nE E R$\t840,00.*020325"
        },
        {
            "numero": 146,
            "enunciado": "O gerente de uma loja de roupas resolveu avaliar o \ndesempenho dos seus vendedores, registrando o total \nde vendas em reais V que cada um deles realizou em \num mês. De acordo com o valor de V, o desempenho do \nvendedor recebeu u ma\tclassificação,\tconforme\ta\tseguir:\n• N1: se V for maior que 20 000;\n• N2: se V ∈ ]10 000, 20 000];\n• N3: se V ∈ ]7 000, 10 000];\n• N4: se V ∈ ]4 000, 7 000];\n• N5: se V ∈ [0, 4 000].\nNo último mês, a funcionária Valéria vendeu  \nR$\t10\t000,00\tem\troupas,\tenquanto\t Bianca\tvendeu\t35%\t\na menos que sua colega.\n\tAs\tclassificações\t que\tValéria\te\tBianca\treceberam\t foram,\t\nrespectivame nte, \nA A N2 e N3.\nB B N2 e N4.\nC C N2 e N5.\nD D N3 e N4.\nE E N3 e N5.",
            "pergunta": "Pergunta não detectada",
            "alternativas": {
                "A": "A N2 e N3.",
                "B": "B N2 e N4.",
                "C": "C N2 e N5.",
                "D": "D N3 e N4.",
                "E": "E N3 e N5."
            },
            "bibliografia": "Não Informada"
        },
        {
            "numero": 147,
            "enunciado": "Os países anglófonos, como a Inglaterra, o Canadá, a \nAustrália\te\toutros,\tsão\tpaíses\tque\tutilizam\tdois\tsistemas\t\nde\tunidades\tpara\ta\tidentificação\t de\tdistâncias:\t o\tSistema\t\nInternacional,\t com\to\tquilômetro\t (km),\te\to\tCGS,\tcom\ta\t\nmilha\t(mi).\tNas\trodovias\tcanadenses,\t por\texemplo,\t as\t\nplacas\tde\tsinalização\t de\tdistâncias\t apresentam\t dois\t\nvalores, um em km e outro em mi, com esta última \nequivalente a aproximadamente 1 610 metros.\nUm turista brasileiro, habituado ao Sistema \nInternacional, em viagem por uma dessas rodovias, \nverifica\tem\tdado\tmomento\t uma\tplaca\tindicando\t a\t\ndistância\taté\ta\tcidade\ta\tque\tele\tse\tdestina,\tonde\testá\t\nescrito\t50\tmi\te\tXX\tkm,\tcom\to\tvalor\tda\tdistância\t em\t\nquilômetro ilegível.\n\nA A 8\nB B 31\nC C 80\nD D 310\nE E 805",
            "pergunta": "Qual o valor, desprezando as casas decimais, que \ndeveria\testar\tescrito\tna\tplaca,\tpara\tidentificar\t a\t\ndistância\tXX,\tem\tquilômetro,\taté\ta\tcidade\tdestino?",
            "alternativas": {
                "A": "A 8",
                "B": "B 31",
                "C": "C 80",
                "D": "D 310",
                "E": "E 805"
            },
            "bibliografia": "Não Informada"
        },
        {
            "numero": 148,
            "enunciado": "Três amigos realizaram uma viagem de carro entre \nduas\tcidades,\tnum\ttempo\ttotal\tde\t31\thoras.\tPara\tnão\t\nfazer\tparadas,\trevezaram\t na\tdireção,\tde\tforma\tque\tcada\t\num deles dirigisse um terço da quilometragem total. \nO primeiro, mais prudente, dirigiu a uma velocidade \nmédia de 75 quilômetros por hora; o segundo, a uma \nvelocidade média de 90 quilômetros por hora; e o último, \nmais apressado, dirigiu a uma velocidade média de  \n100 quilômetros por hora.\nA\tdistância\tpercorrida\tpor\teles,\tem\tquilômetros,\tfoi\tde\nA A 900.\nB B 2 700.\nC C 2 738.\nD D 2 790.\nE E 8 215.",
            "pergunta": "Pergunta não detectada",
            "alternativas": {
                "A": "A 900.",
                "B": "B 2 700.",
                "C": "C 2 738.",
                "D": "D 2 790.",
                "E": "E 8 215."
            },
            "bibliografia": "Não Informada"
        },
        {
            "numero": 149,
            "enunciado": "A meta de uma concessionária de automóveis é \nvender,\tpelo\tmenos,\t104\tcarros\tpor\tmês.\tSabe-se\t\nque,\tem\tmédia,\tem\tdias\tem\tque\tnão\tsão\toferecidos\t\ndescontos,\t são\tvendidos\t 3\tcarros\tpor\tdia;\tem\tdias\tem\t\nque\thá\to\tdesconto\tmínimo,\tsão\tvendidos\t4\tcarros\tpor\tdia;\t\ne,\tem\tdias\tem\tque\thá\to\tdesconto\tmáximo,\tsão\tvendidos\t\n5 carros por dia.\nNo\tmês\tatual,\taté\to\tfim\tdo\texpediente\t do\tsexto\tdia\t\nem\tque\ta\tconcessionária\t abriu,\tnão\tforam\toferecidos\t\ndescontos, tendo sido vendidos 18 carros, conforme \nindicava a média. Ela ainda abrirá por mais 20 dias neste \nmês.\nA menor quantidade de dias em que será necessário \noferecer o desconto máximo, de modo que ainda seja \npossível a concessionária alcançar sua meta de vendas \npara o mês, é\nA A 6.\nB B 10.\nC C 11.\nD D 13.\nAZ19*\n20 \nMT - 2° dia | Caderno 7 - AZUL - 2ª Aplicação\nENEM 2022 ENEM 2022 ENEM 2022 ENEM 2022 ENEM 2022 ENEM 2022 ENEM 2022 ENEM 2022 ENEM 2022 ENEM 2022 ENEM 2022 ENEM 2022 ENEM 2022 ENEM 2022 ENEM 2022 ENEM 2022 ENEM 2022 ENEM 2022 ENEM 2022 ENEM 2022 ENEM 2022 ENEM 2022 ENEM 2022 ENEM 2022 ENEM 2022 ENEM 2022 ENEM 2022 ENEM 2022 ENEM 2022 ENEM 2022 ENEM 2022 ENEM 2022 ENEM 2022 ENEM 2022 ENEM 2022 ENEM 2022 ENEM 2022 ENEM 2022 ENEM 2022 ENEM 2022 ENEM 2022 ENEM 2022 ENEM 2022 ENEM 2022 ENEM 2022 ENEM 2022 ENEM 2022 ENEM 2022 ENEM 2022 ENEM 2022 ENEM 2022 ENEM 2022 ENEM 2022 ENEM 2022 ENEM 2022 ENEM 2022 ENEM 2022 ENEM 2022 ENEM 2022 ENEM 2022 ENEM 2022 ENEM 2022 ENEM 2022",
            "pergunta": "Pergunta não detectada",
            "alternativas": {
                "A": "A 6.",
                "B": "B 10.",
                "C": "C 11.",
                "D": "D 13."
            },
            "bibliografia": "E E 18.\n *020325"
        },
        {
            "numero": 150,
            "enunciado": "Um novo produto, denominado bolo de caneca no \nmicro-ondas,\t foi\tlançado\tno\tmercado\tcom\to\tobjetivo\tde\t\natingir\tao\tpúblico\tque\tnão\ttem\tmuito\ttempo\tpara\tcozinhar.\t\nPara\tprepará-lo,\t uma\tpessoa\ttem\tà\tsua\tdisposição\t duas\t\nopções\tde\tcanecas,\tapresentadas\tna\tfigura.\nCaneca A Caneca B\nA caneca A tem formato de um prisma reto regular \nhexagonal de lado L = 4 cm, e a caneca B tem formato \nde\tum\tcilindro\tcircular\treto\tde\tdiâmetro\t d = 6 cm.  \nSabe-se\tque\tambas\ttêm\ta\tmesma\taltura\t h = 10 cm, e que \nessa pessoa escolherá a caneca com maior capacidade.  \nConsidere π = 3,1 e 31 7=,.\nA medida da capacidade, em centímetro cúbico, da \ncaneca escolhida é\nA A 186.\nB B 279.\nC C 408.\nD D 816.\nE E 1 116.",
            "pergunta": "Pergunta não detectada",
            "alternativas": {
                "A": "A 186.",
                "B": "B 279.",
                "C": "C 408.",
                "D": "D 816.",
                "E": "E 1 116."
            },
            "bibliografia": "Não Informada"
        },
        {
            "numero": 151,
            "enunciado": "Um investidor comprou ações de uma empresa em \n3\tde\tmaio\tde\tcerto\tano\t(uma\tsegunda-feira),\t pagando\t\nR$\t20,00\tpor\tcada\tuma.\tAs\tações\tmantinham\t seus\t\npreços inalterados por uma semana e tinham novos \nvalores\tdivulgados\t pela\tempresa\ta\tcada\tsegunda-feira, \t\nantes\tda\trealização\t de\tqualquer\t negócio.\t O\tquadro\t\nilustra o valor de uma dessas ações, em real, ao longo \nde algumas semanas.\nSemana Valor (R$)\n03 a 09 de maio 20\n10 a 16 de maio 25\n17 a 23 de maio 20\n24 a 30 de maio 35\n31 de maio a 06 de junho 45\nO investidor vendeu suas ações em 7 de junho, mas \nfez\tisso\tantes\tda\tdivulgação\t do\tvalor\tdas\tações\tnaquela\t\nsemana.\tE\tobteve,\tpor\tcada\tação,\ta\tmédia\tentre\tos\t\nvalores unitários da primeira e última semanas indicados \nno quadro.\nSuponha\t que\to\tvalor\tdivulgado\t para\tuma\tação\t\ndaquela empresa na semana de 7 a 13 de junho tenha \nsido\t30%\tmaior\tque\ta\tmédia\tdos\tvalores\tnas\tsemanas\t\nobservadas no quadro.\n\nA A 4,55\nB B 5,20\nC C 9,75\nD D 16,25\nE E 26,00*020325AZ20*\n 21\nMT - 2° dia | Caderno 7 - AZUL - 2ª Aplicação\nENEM 2022 ENEM 2022 ENEM 2022 ENEM 2022 ENEM 2022 ENEM 2022 ENEM 2022 ENEM 2022 ENEM 2022 ENEM 2022 ENEM 2022 ENEM 2022 ENEM 2022 ENEM 2022 ENEM 2022 ENEM 2022 ENEM 2022 ENEM 2022 ENEM 2022 ENEM 2022 ENEM 2022 ENEM 2022 ENEM 2022 ENEM 2022 ENEM 2022 ENEM 2022 ENEM 2022 ENEM 2022 ENEM 2022 ENEM 2022 ENEM 2022 ENEM 2022 ENEM 2022 ENEM 2022 ENEM 2022 ENEM 2022 ENEM 2022 ENEM 2022 ENEM 2022 ENEM 2022 ENEM 2022 ENEM 2022 ENEM 2022 ENEM 2022 ENEM 2022 ENEM 2022 ENEM 2022 ENEM 2022 ENEM 2022 ENEM 2022 ENEM 2022 ENEM 2022 ENEM 2022 ENEM 2022 ENEM 2022 ENEM 2022 ENEM 2022 ENEM 2022 ENEM 2022 ENEM 2022 ENEM 2022 ENEM 2022 ENEM 2022",
            "pergunta": "Se o investidor tivesse vendido as ações pelo preço \ndivulgado para a semana de 7 a 13 de junho, quanto ele \nteria\trecebido\ta\tmais,\tem\treal,\tpela\tvenda\tde\tcada\tação?",
            "alternativas": {
                "A": "A 4,55",
                "B": "B 5,20",
                "C": "C 9,75",
                "D": "D 16,25",
                "E": "E 26,00"
            },
            "bibliografia": "Não Informada"
        },
        {
            "numero": 152,
            "enunciado": "Uma empresa produz um equipamento para \naquecimento de banheiras de hidromassagem. \nPor meio de uma amostra representativa de seus \nprodutos, registrou em um quadro a quantidade desses \nequipamentos que apresentaram algum defeito e em \nquanto tempo isso ocorreu. \nDurabilidade \n(mês)Número de \nequipamentos \ncom defeito\n01 05\n03 07\n05 38\n06 12\n09 102\n12 24\n15 90\n18 110\n20 02\n24 10\nTotal 400\nEssa empresa pretende estabelecer um tempo de \ngarantia\tpara\tesse\tequipamento,\t trocando-o\t caso\tnão\t\ndure o tempo de garantia estabelecido. No entanto, \na\tempresa\t não\tdeseja\ttrocar\tmais\tdo\tque\t3%\tdos\t\nequipamentos.\nCom base nessas informações, o tempo de garantia \ndeve ser de\nA A 3 meses.\nB B 6 meses.\nC C 12 meses.\nD D 20 meses.\nE E 24 meses.",
            "pergunta": "Pergunta não detectada",
            "alternativas": {
                "A": "A 3 meses.",
                "B": "B 6 meses.",
                "C": "C 12 meses.",
                "D": "D 20 meses.",
                "E": "E 24 meses."
            },
            "bibliografia": "Não Informada"
        },
        {
            "numero": 153,
            "enunciado": "O\tgráfico\ta\tseguir\tassocia\ta\tdistância\tpercorrida\t (em\t\nquilômetro)\t com\to\ttempo\t(em\tminuto)\tgasto\tpor\tum\tgrupo\t\nde carros que partiu de um mesmo ponto e se deslocou \nem um trecho de uma rodovia. Esse grupo parou em três \nsemáforos\t(S1, S2 e S3) ao longo do percurso feito.\nDistância (km)\nTempo (min)14\n12\n10\n8\n6\n4\n2\n0 2468101214161820\n.\nAs\tdistâncias,\t em\tquilômetro,\t do\tponto\tde\tpartida\ta\tcada\t\num dos semáforos S1, S2 e S3\tsão\nA A 2, 6 e 8.\nB B 2, 8 e 16.\nC C 4, 4 e 2.\nD D 4, 8 e 10.\nE E 4, 10 e 18.*020325AZ21*\n22 \nMT - 2° dia | Caderno 7 - AZUL - 2ª Aplicação\nENEM 2022 ENEM 2022 ENEM 2022 ENEM 2022 ENEM 2022 ENEM 2022 ENEM 2022 ENEM 2022 ENEM 2022 ENEM 2022 ENEM 2022 ENEM 2022 ENEM 2022 ENEM 2022 ENEM 2022 ENEM 2022 ENEM 2022 ENEM 2022 ENEM 2022 ENEM 2022 ENEM 2022 ENEM 2022 ENEM 2022 ENEM 2022 ENEM 2022 ENEM 2022 ENEM 2022 ENEM 2022 ENEM 2022 ENEM 2022 ENEM 2022 ENEM 2022 ENEM 2022 ENEM 2022 ENEM 2022 ENEM 2022 ENEM 2022 ENEM 2022 ENEM 2022 ENEM 2022 ENEM 2022 ENEM 2022 ENEM 2022 ENEM 2022 ENEM 2022 ENEM 2022 ENEM 2022 ENEM 2022 ENEM 2022 ENEM 2022 ENEM 2022 ENEM 2022 ENEM 2022 ENEM 2022 ENEM 2022 ENEM 2022 ENEM 2022 ENEM 2022 ENEM 2022 ENEM 2022 ENEM 2022 ENEM 2022 ENEM 2022",
            "pergunta": "Pergunta não detectada",
            "alternativas": {
                "A": "A 2, 6 e 8.",
                "B": "B 2, 8 e 16.",
                "C": "C 4, 4 e 2.",
                "D": "D 4, 8 e 10.",
                "E": "E 4, 10 e 18."
            },
            "bibliografia": "TEIXEIRA, P. et al. Funções 10º escolaridade.\tLisboa:\tMinistério\tda\tEducação,\t1997"
        },
        {
            "numero": 154,
            "enunciado": "A tarifa da energia elétrica no Brasil tem sofrido \nvariações\t em\tfunção\tdo\tseu\tcusto\tde\tprodução, \t\nseguindo um sistema de bandeiras tarifárias. Esse \nsistema\tindica\tse\thaverá\tou\tnão\tacréscimo\t no\tvalor\t\ndo\tquilowatt-hora\t (kWh).\tSuponha\t que\to\trepasse\tao\t\nconsumidor\tfinal\tseja\tda\tseguinte\tmaneira:\n• bandeira\tverde:\ta\ttarifa\tnão\tsofre\tacréscimo;\n• bandeira amarela: a tarifa sofre acréscimo de  \nR$\t0,015\tpara\tcada\tkWh\tconsumido;\n• bandeira vermelha — patamar 1: a tarifa sofre \nacréscimo\tde\tR$\t0,04\tpara\tcada\tkWh\tconsumido;\n• bandeira vermelha — patamar 2: a tarifa sofre \nacréscimo\tde\tR$\t0,06\tpara\tcada\tkWh\tconsumido.\nA conta de energia elétrica em uma residência é \nconstituída apenas por um valor correspondente à \nquantidade de energia elétrica consumida no período \nmedido, multiplicada pela tarifa correspondente.  \nO valor da tarifa em um período com uso da bandeira \nverde\té\tR$\t0,42\tpor\tkWh\tconsumido.\t Uma\tforte\t\nestiagem\t justificou\t a\talteração\t da\tbandeira\tverde\tpara\t\na bandeira vermelha — patamar 2.\nUm usuário, cujo consumo é tarifado na bandeira \nverde,\tobserva\to\tseu\tconsumo\t médio\tmensal.\tPara\tnão\t\nafetar o seu orçamento familiar, ele pretende alterar a sua \nprática de uso de energia, reduzindo o seu consumo, de \nmaneira que a sua próxima fatura tenha, no máximo, o \nmesmo valor da conta de energia do período em que era \naplicada a bandeira verde.\n\nA A 6,0%\nB B 12,5%\nC C 14,3%\nD D 16,6%\nE E 87,5%",
            "pergunta": "Qual\tpercentual\t mínimo\tde\tredução\tde\tconsumo\t esse\t\nusuário\tdeverá\tpraticar\tde\tforma\ta\tatingir\tseu\tobjetivo?",
            "alternativas": {
                "A": "A 6,0%",
                "B": "B 12,5%",
                "C": "C 14,3%",
                "D": "D 16,6%",
                "E": "E 87,5%"
            },
            "bibliografia": "Não Informada"
        },
        {
            "numero": 155,
            "enunciado": "As\tbactérias\t são\tmicrorganismos\t formados\t por\tuma\t\núnica\tcélula.\tElas\testão\tpresentes\t em\tpraticamente \t\ntodos os meios: no ar, na água, no solo ou no interior de \noutros\tseres\tvivos.\tA\tforma\tde\treprodução\t mais\tcomum\t\ndas bactérias é a assexuada por bipartição. Nesse \nprocesso, cada uma delas tem seu DNA duplicado e, \nposteriormente, se divide em duas células bacterianas.\nDe modo geral, em condições favoráveis, esse \nprocesso\tde\tbipartição\tse\tconclui\ta\tcada\t20\tminutos.\n\t(adaptado).\nConsidere que, no instante t = 0, há uma quantidade N0 \nde\tbactérias\t em\tum\tmeio\t favorável\tà\tsua\treprodução,\t de\t\nmodo\tque\tnele\tsó\tse\treproduzem\tpor\tbipartição.\nA sequência formada pela quantidade de bactérias nesse \nmeio nos instantes 0, 20, 40, 60, 80 e 100 minutos é\nA A N0 , N02, N03, N04, N05, N06 \nB B N0 , N02, N04, N08, N016, N032\nC C N0 , 2N0 , 3N0 , 4N0 , 5N0 , 6N0\nD D N0 , 2N0 , 4N0 , 8N0 , 16N0 , 32N0 \nE E N0 , 3N0 , 7N0 , 15N0 , 31N0 , 63N0*020325AZ22*\n 23\nMT - 2° dia | Caderno 7 - AZUL - 2ª Aplicação\nENEM 2022 ENEM 2022 ENEM 2022 ENEM 2022 ENEM 2022 ENEM 2022 ENEM 2022 ENEM 2022 ENEM 2022 ENEM 2022 ENEM 2022 ENEM 2022 ENEM 2022 ENEM 2022 ENEM 2022 ENEM 2022 ENEM 2022 ENEM 2022 ENEM 2022 ENEM 2022 ENEM 2022 ENEM 2022 ENEM 2022 ENEM 2022 ENEM 2022 ENEM 2022 ENEM 2022 ENEM 2022 ENEM 2022 ENEM 2022 ENEM 2022 ENEM 2022 ENEM 2022 ENEM 2022 ENEM 2022 ENEM 2022 ENEM 2022 ENEM 2022 ENEM 2022 ENEM 2022 ENEM 2022 ENEM 2022 ENEM 2022 ENEM 2022 ENEM 2022 ENEM 2022 ENEM 2022 ENEM 2022 ENEM 2022 ENEM 2022 ENEM 2022 ENEM 2022 ENEM 2022 ENEM 2022 ENEM 2022 ENEM 2022 ENEM 2022 ENEM 2022 ENEM 2022 ENEM 2022 ENEM 2022 ENEM 2022 ENEM 2022",
            "pergunta": "Pergunta não detectada",
            "alternativas": {
                "A": "A N0 , N02, N03, N04, N05, N06",
                "B": "B N0 , N02, N04, N08, N016, N032",
                "C": "C N0 , 2N0 , 3N0 , 4N0 , 5N0 , 6N0",
                "D": "D N0 , 2N0 , 4N0 , 8N0 , 16N0 , 32N0",
                "E": "E N0 , 3N0 , 7N0 , 15N0 , 31N0 , 63N0"
            },
            "bibliografia": "Disponível\tem:\twww.sobiologia.com.br.\t Acesso\tem:\t16\tnov.\t2013"
        },
        {
            "numero": 156,
            "enunciado": "No\tmercado\t de\tvalores,\t denominam-se\t ativos\t\ndiversos produtos que podem ser negociados em \nmercados\t de\tvalores\t(ações\tde\tuma\tcompanhia,\t moeda\t\nestrangeira, metais preciosos, entre outros).\nCurioso para descobrir o melhor momento para \nvender um ativo, um jovem perguntou a um corretor o que \nfazer. Ele respondeu que sempre sugere a seus clientes \nque\tverifiquem \to\tgráfico\tque\trepresenta\t a\tvariação,\t nas\t\núltimas horas, do preço do ativo que lhes interessa, \numa\tvez\tque\tsão\tde\tfácil\tleitura,\tpois\tsão\tformados\t por\t\nsegmentos de reta. Um bom momento para vender é \nimediatamente\t após\to\tgráfico\tapresentar\t dois\tperíodos\t\nconsecutivos\t cujos\tsegmentos\t têm\tinclinação\t positiva,\t\nsendo\tque\tno\tsegundo\ta\tinclinação\t é\tmaior\tou\tigual\ta\t\n45°.\tPara\texemplificar,\t mostrou\tao\tjovem\to\tgráfico\ta\t\nseguir,\tno\tqual\tse\tobserva\ta\tvariação\tdo\tpreço\tde\tum\t\nativo num período de 19 horas.\n\nA A 7\nB B 4\nC C 3\nD D 2\nE E 1",
            "pergunta": "Preço (R$)\nTempo\n(h)27,90\n27,23\n23,92\n22,9330\n26,5226,01\n25,19\n23,92\n23,92\n123,5 6 8 1112 15 17 19\nEm\tquantos\tperíodos\t a\tvariação\t do\tpreço\tdo\tativo,\t\napresentada\t no\tgráfico,\tindicava\t que\tera\tum\tbom\t\nmomento\tpara\tefetuar\ta\tvenda?",
            "alternativas": {
                "A": "A 7",
                "B": "B 4",
                "C": "C 3",
                "D": "D 2",
                "E": "E 1"
            },
            "bibliografia": "Não Informada"
        },
        {
            "numero": 157,
            "enunciado": "Uma cidade enfrenta racionamento no abastecimento \nde água. Para minimizar os efeitos da falta de água para \nseus hóspedes, o gerente de um hotel pretende substituir \na\tcaixa-d’água\t existente\t por\tum\treservatório.\t Sabe-se\t\nque o consumo médio diário do hotel é de 10 mil litros de \nágua. Mantido o consumo médio diário, o gerente quer \nque o novo reservatório, uma vez cheio, seja capaz de \nsuprir as necessidades do hotel por, pelo menos, 6 dias \ncompletos,\t mesmo\tque\tnão\thaja\tabastecimento\t de\tágua\t\nnesse período.\nO espaço de que o hotel dispõe para instalar o novo \nreservatório tem formato retangular com largura de 5 m \ne comprimento de 6 m. O gerente analisa cinco opções \ndisponíveis para esse reservatório.\nReservatórios retangulares\nReservatórioLargura \n(m)Comprimento \n(m)Altura \n(m)\nR16 6 2\nR24 5 2,5\nR35 6 2\nReservatórios cilíndricos\nReservatório Raio\t(m) Altura\t(m)\nR46 6\nR54 5\nA\topção\tde\treservatório\t que\tatende\tà\tnecessidade\t do\t\nhotel e que cabe no espaço disponível é\nA A R1.\nB B R2.\nC C R3.\nAZ23*\n24 \nMT - 2° dia | Caderno 7 - AZUL - 2ª Aplicação",
            "pergunta": "Pergunta não detectada",
            "alternativas": {
                "A": "A R1.",
                "B": "B R2.",
                "C": "C R3."
            },
            "bibliografia": "D D R4.\nE E R5.*020325"
        },
        {
            "numero": 158,
            "enunciado": "Para tornar uma pista de automobilismo mais segura, foram solicitadas intervenções em seu traçado.  \nOs engenheiros contratados elaboraram um projeto com cinco possíveis modificações, destacadas nos setores \n(I),\t(II),\t(III),\t(IV)\te\t(V)\tpelas\tlinhas\ttracejadas,\t como\tmostra\ta\tfigura.\tNo\tentanto,\tna\ttemporada\t atual,\tsó\té\t\npermitido que se façam duas dessas alterações.\nTodos\tos\ttrechos\tpassíveis\t de\tmodificação,\t tanto\tno\ttraçado\toriginal\tquanto\tno\tnovo\ttraçado,\t são\t\nsemicircunferências ou segmentos de reta.\nIIIIIIV200 m V\nI60°60°\n50 m360 m\n480 m400 m300 m\nPista original\nNovo trecho\nna pista \nPretende-se\t que\ta\tnova\tpista\ttenha\textensão\tmais\tpróxima\tque\ta\tda\toriginal\tapós\tduas\tmodificações.\t Os\ttrechos\t\nem\tcomum\tda\tpista\toriginal\te\tda\tnova\tpista\tnão\tserão\talterados.\nUtilize\t3\tcomo\taproximação\tpara\t π.\n\nA A I e V\nB B II e III\nC C II e V\nD D III e IV\nE E IV e V",
            "pergunta": "Para\tatender\tàs\tcondições\tapresentadas,\tquais\tsetores\tdeverão\tser\tmodificados?",
            "alternativas": {
                "A": "A I e V",
                "B": "B II e III",
                "C": "C II e V",
                "D": "D III e IV",
                "E": "E IV e V"
            },
            "bibliografia": "Não Informada"
        },
        {
            "numero": 159,
            "enunciado": "Um\ttúnel\tviário\tde\tuma\túnica\tvia\tpossui\ta\tentrada\tna\tforma\tde\tum\ttriângulo\tequilátero\t de\tlado\t6\tm.\tO\tmotorista\t\nde\tum\tcaminhão\t com\t3\tm\tde\tlargura\tdeve\tdecidir\tse\tpassa\tpor\tesse\ttúnel\tou\tse\ttoma\tum\tcaminho\tmais\tlongo.\tPara\t\ndecidir,\to\tmotorista\t calcula\ta\taltura\tque\tesse\tcaminhão\t deveria\tter\tpara\ttangenciar\t a\tentrada\tdo\ttúnel.\tConsidere\t o\t\ncaminhão\tcomo\tum\tparalelepípedo\treto.\nEssa altura, em metro, é\nA A 3\nB B 32\nC C 33\nD D 32\n2\nE E 33\n2*020325AZ24*\n 25\nMT - 2° dia | Caderno 7 - AZUL - 2ª Aplicação\nENEM 2022 ENEM 2022 ENEM 2022 ENEM 2022 ENEM 2022 ENEM 2022 ENEM 2022 ENEM 2022 ENEM 2022 ENEM 2022 ENEM 2022 ENEM 2022 ENEM 2022 ENEM 2022 ENEM 2022 ENEM 2022 ENEM 2022 ENEM 2022 ENEM 2022 ENEM 2022 ENEM 2022 ENEM 2022 ENEM 2022 ENEM 2022 ENEM 2022 ENEM 2022 ENEM 2022 ENEM 2022 ENEM 2022 ENEM 2022 ENEM 2022 ENEM 2022 ENEM 2022 ENEM 2022 ENEM 2022 ENEM 2022 ENEM 2022 ENEM 2022 ENEM 2022 ENEM 2022 ENEM 2022 ENEM 2022 ENEM 2022 ENEM 2022 ENEM 2022 ENEM 2022 ENEM 2022 ENEM 2022 ENEM 2022 ENEM 2022 ENEM 2022 ENEM 2022 ENEM 2022 ENEM 2022 ENEM 2022 ENEM 2022 ENEM 2022 ENEM 2022 ENEM 2022 ENEM 2022 ENEM 2022 ENEM 2022 ENEM 2022",
            "pergunta": "Pergunta não detectada",
            "alternativas": {
                "A": "A 3",
                "B": "B 32",
                "C": "C 33",
                "D": "D 32",
                "E": "E 33"
            },
            "bibliografia": "Não Informada"
        },
        {
            "numero": 160,
            "enunciado": "Demografia\t médica\té\to\testudo\tda\tpopulação\t de\t\nmédicos sob vários aspectos quantitativos e qualitativos. \nUm dos componentes desse estudo é a densidade \nmédica,\ta\tqual\té\tobtida\tdividindo-se\t o\tnúmero\tde\tmédicos\t\nregistrados\t no\tConselho\t Federal\tde\tMedicina\t (CFM)\t\nem\tuma\tregião\tpela\trespectiva\t quantidade\t de\tpessoas\t\nda\tUnidade\tFederativa\t (UF)\tcorrespondente\t à\tregião\t\nem estudo. A tabela apresenta informações sobre cinco \nunidades federativas, relativamente ao total de médicos \nregistrados\tno\tCFM\te\tà\tpopulação\texistente.\nUFTotal de \nmédicosPopulação\n(em milhar)\nDistrito Federal 10 800 2 650\nMinas Gerais 40 400 19 900\nSão\tPaulo 110 450 41 900\nSergipe 3 000 2 120\nPiauí 3 300 3 140\n\t(adaptado).\n\nA A Distrito Federal.\nB B Minas Gerais.\nC C São\tPaulo.\nD D Sergipe.\nE E Piauí.",
            "pergunta": "Dentre as unidades federativas indicadas, qual apresenta \na\tmaior\tdensidade\tmédica?",
            "alternativas": {
                "A": "A Distrito Federal.",
                "B": "B Minas Gerais.",
                "C": "C São\tPaulo.",
                "D": "D Sergipe.",
                "E": "E Piauí."
            },
            "bibliografia": "Disponível\tem:\twww.cremesp.org.br.\t Acesso\tem:\t24\tjun.\t2015"
        },
        {
            "numero": 161,
            "enunciado": "As\themácias\t são\tcélulas\tsanguíneas\t responsáveis \t\npelo\ttransporte\t de\tuma\tsubstância\t chamada\t\nhemoglobina,\t a\tqual\ttem\ta\tfunção\tde\tlevar\toxigênio\t\ndos pulmões para os tecidos. Hemácias normais têm \ndiâmetro\tmédio\tde\t7,8\tx\t10\t-6 metros.\n\t(adaptado).\nO\tdiâmetro\t médio\tdessas\themácias,\t em\tmetros,\té\t\nrepresentado\tpela\trazão\t78\nd, em que d é igual a\nA A 10 000.\nB B 100 000.\nC C 1 000 000.\nD D 10 000 000.\nE E 100 000 000.",
            "pergunta": "Pergunta não detectada",
            "alternativas": {
                "A": "A 10 000.",
                "B": "B 100 000.",
                "C": "C 1 000 000.",
                "D": "D 10 000 000.",
                "E": "E 100 000 000."
            },
            "bibliografia": "GUYTON, A. C.; HALL, J. E. Tratado de fisiologia médica .\nRio\tde\tJaneiro:\tElsevier,\t2006"
        },
        {
            "numero": 162,
            "enunciado": "Com o intuito de fazer bombons para vender, uma \ndoceira comprou uma barra de 2 kg de chocolate e 1 L de \ncreme de leite. De acordo com a receita, cada bombom \ndeverá ter exatamente 34 g de chocolate e 12 mL de \ncreme de leite.\n\nA A 5\nB B 8\nC C 58\nD D 71\nE E 83*020325AZ25*\n26 \nMT - 2° dia | Caderno 7 - AZUL - 2ª Aplicação\nENEM 2022 ENEM 2022 ENEM 2022 ENEM 2022 ENEM 2022 ENEM 2022 ENEM 2022 ENEM 2022 ENEM 2022 ENEM 2022 ENEM 2022 ENEM 2022 ENEM 2022 ENEM 2022 ENEM 2022 ENEM 2022 ENEM 2022 ENEM 2022 ENEM 2022 ENEM 2022 ENEM 2022 ENEM 2022 ENEM 2022 ENEM 2022 ENEM 2022 ENEM 2022 ENEM 2022 ENEM 2022 ENEM 2022 ENEM 2022 ENEM 2022 ENEM 2022 ENEM 2022 ENEM 2022 ENEM 2022 ENEM 2022 ENEM 2022 ENEM 2022 ENEM 2022 ENEM 2022 ENEM 2022 ENEM 2022 ENEM 2022 ENEM 2022 ENEM 2022 ENEM 2022 ENEM 2022 ENEM 2022 ENEM 2022 ENEM 2022 ENEM 2022 ENEM 2022 ENEM 2022 ENEM 2022 ENEM 2022 ENEM 2022 ENEM 2022 ENEM 2022 ENEM 2022 ENEM 2022 ENEM 2022 ENEM 2022 ENEM 2022",
            "pergunta": "Respeitando os critérios estabelecidos, quantos \nbombons a doceira poderá fazer utilizando o máximo \nque\tpuder\tos\tingredientes\tcomprados?",
            "alternativas": {
                "A": "A 5",
                "B": "B 8",
                "C": "C 58",
                "D": "D 71",
                "E": "E 83"
            },
            "bibliografia": "Não Informada"
        },
        {
            "numero": 163,
            "enunciado": "Um clube está sendo reformado e deve ter algumas \nparedes\te\tpartes\tdo\tteto\trepintadas.\t São,\tno\ttotal,\t  \n560 m2 de parede e 260 m2 de teto. Segundo orientações \ntécnicas, um entre três tipos diferentes de tinta deve ser \nusado\tpara\tpintar\tas\tparedes\t(tipos\tI,\tII\te\tIII),\te\tum\tentre\t\noutros dois tipos pode ser utilizado na pintura do teto \n(tipos\tX\te\tY).\tAs\tcaracterísticas\t dos\tdiferentes\t produtos\t\nsão\tapresentadas\ta\tseguir:\n• tipo I: vendido em embalagem com 10 L, por  \nR$\t180,00\tcada.\tO\tconteúdo\t permite\tpintar\tuma\t\nárea de 220 m2;\n• tipo II: vendido em embalagem com 20 L, por  \nR$\t350,00\tcada.\tO\tconteúdo\t permite\tpintar\tuma\t\nárea de 450 m2;\n• tipo III: vendido em embalagem com 25 L, por  \nR$\t650,00\tcada.\tO\tconteúdo\t permite\tpintar\tuma\t\nárea de 550 m2;\n• tipo X: vendido em embalagem com 4 L, por  \nR$\t70,00\tcada.\tO\tconteúdo\t permite\tpintar\tuma\t\nárea de 80 m2;\n• tipo Y: vendido em embalagem com 5 L, por  \nR$\t85,00\tcada.\tO\tconteúdo\t permite\tpintar\tuma\t\nárea de 90 m2.\nPretende-se\t gastar\ta\tmenor\tquantia\tpossível,\t em\t\nreal, com essa pintura.\nAs tintas que devem ser escolhidas para uso nas paredes \ne\tteto\tdo\tclube,\trespectivamente,\tsão\tas\tde\ttipos\nA A I e X.\nB B I e Y.\nC C II e X.\nD D II e Y.\nE E III e Y.",
            "pergunta": "Pergunta não detectada",
            "alternativas": {
                "A": "A I e X.",
                "B": "B I e Y.",
                "C": "C II e X.",
                "D": "D II e Y.",
                "E": "E III e Y."
            },
            "bibliografia": "Não Informada"
        },
        {
            "numero": 164,
            "enunciado": "Toda\ta\tiluminação\t de\tum\tescritório\té\tfeita\tutilizando-se\t\n40\tlâmpadas\t incandescentes\t que\tproduzem\t 600\tlúmens\t\n(lúmen\t=\tunidade\tde\tenergia\tluminosa)\t cada.\tO\tgerente\t\nplaneja\treestruturar\t o\tsistema\tde\tiluminação\t desse\t\nescritório,\t utilizando\t somente\t lâmpadas\t fluorescentes\t\nque produzem 1 600 lúmens, para aumentar a quantidade \nde\tenergia\tluminosa\tem\t50%.\nPara alcançar seu objetivo, a quantidade mínima de \nlâmpadas\t fluorescentes\t que\to\tgerente\tdesse\tescritório\t\ndeverá instalar é\nA A 10.\nB B 14.\nC C 15.\nD D 16.\nE E 23.",
            "pergunta": "Pergunta não detectada",
            "alternativas": {
                "A": "A 10.",
                "B": "B 14.",
                "C": "C 15.",
                "D": "D 16.",
                "E": "E 23."
            },
            "bibliografia": "Não Informada"
        },
        {
            "numero": 165,
            "enunciado": "Uma escola realizou uma pesquisa entre todos os \nseus estudantes e constatou que três em cada dez deles \nestão\tmatriculados\t em\talgum\tcurso\textracurricular\t de\t\nlíngua estrangeira.\n\nA A 0,3%\nB B 0,33%\nC C 3%\nD D 30%\nE E 33%",
            "pergunta": "Em\trelação\tao\tnúmero\ttotal\tde\testudantes\t dessa\tescola,\t\nqual porcentagem representa o número de alunos \nmatriculados em algum curso extracurricular de língua \nestrangeira?",
            "alternativas": {
                "A": "A 0,3%",
                "B": "B 0,33%",
                "C": "C 3%",
                "D": "D 30%",
                "E": "E 33%"
            },
            "bibliografia": "Não Informada"
        },
        {
            "numero": 166,
            "enunciado": "A trajetória de uma pessoa que pula de um andaime \naté\to\tchão\té\tdescrita\tpor\tuma\tfunção\t y = f (x), sendo x e y \nmedidos\tem\tmetro,\tconforme\tmostra\ta\tfigura.\n0,0 0,5 1,0 1,51,5\n2,02,0\n2,5 3,00,51,01,0y (metro)\nf (x) = ax2 + bx + c\nx (metro)\nSeja D\to\tdomínio\tda\tfunção\t f (x),\tcomo\tdefinida\tna\t\nfigura.\nPara\tque\ta\tsituação\trepresentada\t na\tfigura\tseja\treal,\to\t\ndomínio\tdessa\tfunção\tdeve\tser\tigual\ta\nA A x2/g94/g96, sendo x2 a raiz positiva de f (x).\nB B xx x /g143/g9502 /g100/g100 /g94/g96 , sendo x2 a raiz positiva de f (x).\nC C xx xx /g143/g9512/g100/g100 /g94/g96 , sendo x1 e x2 raízes de f (x), com \nx1 < x2 .\nAZ26*\n 27\nMT - 2° dia | Caderno 7 - AZUL - 2ª Aplicação\nENEM 2022 ENEM 2022 ENEM 2022 ENEM 2022 ENEM 2022 ENEM 2022 ENEM 2022 ENEM 2022 ENEM 2022 ENEM 2022 ENEM 2022 ENEM 2022 ENEM 2022 ENEM 2022 ENEM 2022 ENEM 2022 ENEM 2022 ENEM 2022 ENEM 2022 ENEM 2022 ENEM 2022 ENEM 2022 ENEM 2022 ENEM 2022 ENEM 2022 ENEM 2022 ENEM 2022 ENEM 2022 ENEM 2022 ENEM 2022 ENEM 2022 ENEM 2022 ENEM 2022 ENEM 2022 ENEM 2022 ENEM 2022 ENEM 2022 ENEM 2022 ENEM 2022 ENEM 2022 ENEM 2022 ENEM 2022 ENEM 2022 ENEM 2022 ENEM 2022 ENEM 2022 ENEM 2022 ENEM 2022 ENEM 2022 ENEM 2022 ENEM 2022 ENEM 2022 ENEM 2022 ENEM 2022 ENEM 2022 ENEM 2022 ENEM 2022 ENEM 2022 ENEM 2022 ENEM 2022 ENEM 2022 ENEM 2022 ENEM 2022",
            "pergunta": "Pergunta não detectada",
            "alternativas": {
                "A": "A x2/g94/g96, sendo x2 a raiz positiva de f (x).",
                "B": "B xx x /g143/g9502 /g100/g100 /g94/g96 , sendo x2 a raiz positiva de f (x).",
                "C": "C xx xx /g143/g9512/g100/g100 /g94/g96 , sendo x1 e x2 raízes de f (x), com"
            },
            "bibliografia": "D D xx/g143/g95 /g116 0 /g94/g96 .\nE E x∈.*020325"
        },
        {
            "numero": 167,
            "enunciado": "Descargas atmosféricas, objetos estranhos e \nquedas de árvores, entre outros motivos, podem gerar \ninterrupções na rede elétrica. Em certo município, um \nlevantamento realizado pela companhia de fornecimento \nde energia relacionou, durante 30 dias, o número de \ninterrupções na rede elétrica com o número de dias em \nque elas ocorreram.\nNúmero de interrupções Número de dias\n0 5\n1 6\n2 6\n3 10\n4 3\nTotal 30\nA\tmoda\te\ta\tmédia\tdiária\tdo\tnúmero\tde\tinterrupções\t são,\t\nrespectivamente, iguais a\nA A 3 e 2,0.\nB B 3 e 2,4.\nC C 3 e 6,0.\nD D 10 e 2,0.\nE E 10 e 2,4.",
            "pergunta": "Pergunta não detectada",
            "alternativas": {
                "A": "A 3 e 2,0.",
                "B": "B 3 e 2,4.",
                "C": "C 3 e 6,0.",
                "D": "D 10 e 2,0.",
                "E": "E 10 e 2,4."
            },
            "bibliografia": "Não Informada"
        },
        {
            "numero": 168,
            "enunciado": "Uma empresa de publicidade está criando um \nlogotipo\tque\ttem\to\tformato\tindicado\tna\tfigura.\tO\tcírculo\t\nmenor está inscrito no quadrado ABCD, e o círculo maior \ncircunscreve o mesmo quadrado. Considere S1 a área do \ncírculo menor e S2 a área do círculo maior.\nD A\nB CO\nA\trazão\tda\tárea\tdo\tcírculo\tmaior\tpara\to\tcírculo\tmenor\té\t\nigual a\nA A 2\nB B 1\n2\nC C 2\nD D 8\nE E 16\n *020325AZ27*\n28 \nMT - 2° dia | Caderno 7 - AZUL - 2ª Aplicação\nENEM 2022 ENEM 2022 ENEM 2022 ENEM 2022 ENEM 2022 ENEM 2022 ENEM 2022 ENEM 2022 ENEM 2022 ENEM 2022 ENEM 2022 ENEM 2022 ENEM 2022 ENEM 2022 ENEM 2022 ENEM 2022 ENEM 2022 ENEM 2022 ENEM 2022 ENEM 2022 ENEM 2022 ENEM 2022 ENEM 2022 ENEM 2022 ENEM 2022 ENEM 2022 ENEM 2022 ENEM 2022 ENEM 2022 ENEM 2022 ENEM 2022 ENEM 2022 ENEM 2022 ENEM 2022 ENEM 2022 ENEM 2022 ENEM 2022 ENEM 2022 ENEM 2022 ENEM 2022 ENEM 2022 ENEM 2022 ENEM 2022 ENEM 2022 ENEM 2022 ENEM 2022 ENEM 2022 ENEM 2022 ENEM 2022 ENEM 2022 ENEM 2022 ENEM 2022 ENEM 2022 ENEM 2022 ENEM 2022 ENEM 2022 ENEM 2022 ENEM 2022 ENEM 2022 ENEM 2022 ENEM 2022 ENEM 2022 ENEM 2022",
            "pergunta": "Pergunta não detectada",
            "alternativas": {
                "D": "D 8",
                "B": "B 1",
                "A": "A 2",
                "C": "C 2",
                "E": "E 16"
            },
            "bibliografia": "Não Informada"
        },
        {
            "numero": 169,
            "enunciado": "Uma indústria de sucos utiliza uma embalagem no \nformato de prisma reto de base quadrada, com aresta da \nbase de medida a e altura de medida h, ambas de mesma \nunidade\tde\tmedida,\tcomo\trepresentado\tna\tfigura.\nSUCO\na\nah\nDeseja-se\t criar\tuma\tlinha\tde\tprodução\t para\t\numa nova embalagem de igual formato, mas que \ndeverá ter uma capacidade igual ao triplo da atual. \nA altura da nova embalagem será igual a 4\n3 da altura \nda embalagem atual. As arestas da base da nova \nembalagem\tserão\tdenominadas\tde\tx .\n\nA A x=a\nB B x=3a\nC C x=9a\nD D x=3\n2a\nE E x=a3",
            "pergunta": "Qual\ta\trelação\tde\tdependência\t entre\ta\tmedida\t x da  \nnova aresta da base e a medida a\tda\taresta\tatual?",
            "alternativas": {
                "A": "A x=a",
                "B": "B x=3a",
                "C": "C x=9a",
                "D": "D x=3",
                "E": "E x=a3"
            },
            "bibliografia": "Não Informada"
        },
        {
            "numero": 170,
            "enunciado": "Num\trestaurante,\t a\túltima\tsexta-feira\t do\tmês\té\to\t\nDia da Solidariedade: as gorjetas arrecadadas nesse dia \nserão\tdistribuídas,\t igualmente,\t entre\ttodos\tos\tgarçons\t\nque estiverem trabalhando nessa data. Para um maior \ncontrole, o administrador do restaurante organiza uma \ntabela das gorjetas arrecadadas por cada garçom; \nassim, ele pode distribuir corretamente os valores a cada \num deles. O quadro de certo Dia da Solidariedade é \napresentado a seguir.\n\nA A R$\t16,00\nB B R$\t17,00\nC C R$\t18,00\nD D R$\t19,00\nE E R$\t20,00",
            "pergunta": "Garçom Total de gorjetas recebidas (R$)\nA 17,00\nB 24,00\nC Folga\nD 17,00\nE 20,00\nF Folga\nG 16,00\nH 27,00\nI 18,00\nJ 21,00\nQuanto cada garçom recebeu do total das gorjetas nesse \nDia\tda\tSolidariedade?",
            "alternativas": {
                "A": "A R$\t16,00",
                "B": "B R$\t17,00",
                "C": "C R$\t18,00",
                "D": "D R$\t19,00",
                "E": "E R$\t20,00"
            },
            "bibliografia": "Não Informada"
        },
        {
            "numero": 171,
            "enunciado": "O chocolate é um dos alimentos mais apreciados \ne desejados do mundo. Uma loja especializada nesse \nproduto\toferece\tuma\tpromoção\t para\tos\tbombons,\t que\t\ncustam\tR$\t2,00\tcada.\tCada\tcliente\ttem\tx%\tde\tdesconto\t\nna compra de x\t bombons.\t A\tpromoção\t é\tválida\tpara\ta\t\ncompra\tde\taté\t40\tbombons,\t ou\tseja,\t40%\té\to\tdesconto\t\nmáximo\tpossível.\t Queremos\t escrever\t uma\texpressão\t\npara V em\tfunção\tde\tx, com x≤40.\n\nA A Vx=1\n502\nB B Vx/g32/g1621\n50\nC C Vx x /g32/g1621\n502\nD D Vx x /g32/g161\n1002\nE E Vx x /g32/g1621\n100*020325AZ28*\n 29\nMT - 2° dia | Caderno 7 - AZUL - 2ª Aplicação\nENEM 2022 ENEM 2022 ENEM 2022 ENEM 2022 ENEM 2022 ENEM 2022 ENEM 2022 ENEM 2022 ENEM 2022 ENEM 2022 ENEM 2022 ENEM 2022 ENEM 2022 ENEM 2022 ENEM 2022 ENEM 2022 ENEM 2022 ENEM 2022 ENEM 2022 ENEM 2022 ENEM 2022 ENEM 2022 ENEM 2022 ENEM 2022 ENEM 2022 ENEM 2022 ENEM 2022 ENEM 2022 ENEM 2022 ENEM 2022 ENEM 2022 ENEM 2022 ENEM 2022 ENEM 2022 ENEM 2022 ENEM 2022 ENEM 2022 ENEM 2022 ENEM 2022 ENEM 2022 ENEM 2022 ENEM 2022 ENEM 2022 ENEM 2022 ENEM 2022 ENEM 2022 ENEM 2022 ENEM 2022 ENEM 2022 ENEM 2022 ENEM 2022 ENEM 2022 ENEM 2022 ENEM 2022 ENEM 2022 ENEM 2022 ENEM 2022 ENEM 2022 ENEM 2022 ENEM 2022 ENEM 2022 ENEM 2022 ENEM 2022",
            "pergunta": "Qual\té\ta\texpressão\t do\tvalor\t V, em reais, na compra de x \nbombons\tda\tpromoção,\tpor\tcliente?",
            "alternativas": {
                "A": "A Vx=1",
                "B": "B Vx/g32/g1621",
                "C": "C Vx x /g32/g1621",
                "D": "D Vx x /g32/g161",
                "E": "E Vx x /g32/g1621"
            },
            "bibliografia": "Não Informada"
        },
        {
            "numero": 172,
            "enunciado": "Um engenheiro fará um projeto de uma casa cujo \nterreno\ttem\to\tformato\tde\tum\tretângulo\t de\t36\tm\tde\t\ncomprimento por 9 m de largura. Para isso, ele fará um \ndesenho\tde\tum\tretângulo\t de\t24\tcm\tde\tcomprimento\t por\t\n6 cm de largura.\n\nA A 150 : 1\nB B 225 : 1\nC C 600 : 1\nD D 2,25 : 1\nE E 1,5 : 1",
            "pergunta": "Qual\tdeve\tser\ta\tescala\tutilizada\tpelo\tengenheiro?",
            "alternativas": {
                "A": "A 150 : 1",
                "B": "B 225 : 1",
                "C": "C 600 : 1",
                "D": "D 2,25 : 1",
                "E": "E 1,5 : 1"
            },
            "bibliografia": "Não Informada"
        },
        {
            "numero": 173,
            "enunciado": "Três amigos, A, B e C, se encontraram em um \nsupermercado. Por coincidência, estavam comprando os \nmesmos itens, conforme o quadro.\nAmigos Arroz (kg) Feijão (kg) Macarrão (kg)\nA 3 2 4\nB 2 3 3\nC 2 2 2\nOs amigos estavam muito entretidos na conversa e \nnem perceberam que pagaram suas compras, pegaram \nseus trocos e esqueceram seus comprovantes. Já longe \ndo supermercado, “A” lembrou que precisava saber o \nquanto pagou por um quilo de arroz e dois quilos de \nmacarrão,\t pois\testava\tcomprando\t para\tsua\tvizinha\te\t\nesperava\t ser\tressarcido.\t “B”,\tque\tadorava\tdesafios\t\nmatemáticos, disse que pagou suas compras com  \nR$\t40,00\te\tobteve\ttroco\tde\tR$\t7,30,\te\tque\tconseguiria \t\ndeterminar o custo desses itens se os amigos  \ndissessem como pagaram e quanto foram seus \nrespectivos\t trocos.\t“A”\tdisse\tque\tpagou\tcom\tR$\t40,00\t\ne\tobteve\ttroco\tde\tR$\t4,00,\te\t“C”\tpagou\tcom\tR$\t30,00\te\t\nobteve\ttroco\tde\tR$\t5,40.\nA vizinha de “A” deve a ele pela compra, em reais, o valor \nde\nA A 8,10.\nB B 10,00.\nC C 11,40.\nD D 12,00.\nE E 13,20.",
            "pergunta": "Pergunta não detectada",
            "alternativas": {
                "A": "A 8,10.",
                "B": "B 10,00.",
                "C": "C 11,40.",
                "D": "D 12,00.",
                "E": "E 13,20."
            },
            "bibliografia": "Não Informada"
        },
        {
            "numero": 174,
            "enunciado": "Uma empresa tem cinco setores, cada um com quatro \nfuncionários, sendo que cada funcionário de um setor tem \num cargo diferente. O quadro apresenta os salários, em \nreal, dos funcionários de cada um desses setores, por \ncargo.\nSetorSalário \npara o \ncargo 1\n(R$)Salário \npara o \ncargo 2\n(R$)Salário \npara o \ncargo 3\n(R$)Salário \npara o \ncargo 4\n(R$)\nI 1 550,00 1 140,00 1 140,00 1 150,00\nII 1 100,00 1 100,00 1 520,00 1 200,00\nIII 1 050,00 1 050,00 1 600,00 2 000,00\nIV 1 300,00 1 160,00 1 280,00 1 280,00\nV 1 250,00 1 300,00 1 300,00 1 150,00\nA\tempresa\t pretende\t incentivar\t a\tqualificação\t\nprofissional,\t oferecendo\t cursos\tgratuitos\t para\tos\t\nfuncionários de todos os cinco setores. Entretanto, o \nprimeiro curso será oferecido aos funcionários do setor \nque apresenta a menor média salarial por cargo.\nO primeiro curso será oferecido aos funcionários do \nsetor\nA A I.\nB B II.\nC C III.\nAZ29*\n30 \nMT - 2° dia | Caderno 7 - AZUL - 2ª Aplicação\nENEM 2022 ENEM 2022 ENEM 2022 ENEM 2022 ENEM 2022 ENEM 2022 ENEM 2022 ENEM 2022 ENEM 2022 ENEM 2022 ENEM 2022 ENEM 2022 ENEM 2022 ENEM 2022 ENEM 2022 ENEM 2022 ENEM 2022 ENEM 2022 ENEM 2022 ENEM 2022 ENEM 2022 ENEM 2022 ENEM 2022 ENEM 2022 ENEM 2022 ENEM 2022 ENEM 2022 ENEM 2022 ENEM 2022 ENEM 2022 ENEM 2022 ENEM 2022 ENEM 2022 ENEM 2022 ENEM 2022 ENEM 2022 ENEM 2022 ENEM 2022 ENEM 2022 ENEM 2022 ENEM 2022 ENEM 2022 ENEM 2022 ENEM 2022 ENEM 2022 ENEM 2022 ENEM 2022 ENEM 2022 ENEM 2022 ENEM 2022 ENEM 2022 ENEM 2022 ENEM 2022 ENEM 2022 ENEM 2022 ENEM 2022 ENEM 2022 ENEM 2022 ENEM 2022 ENEM 2022 ENEM 2022 ENEM 2022 ENEM 2022",
            "pergunta": "Pergunta não detectada",
            "alternativas": {
                "A": "A I.",
                "B": "B II.",
                "C": "C III."
            },
            "bibliografia": "D D IV.\nE E V.*020325"
        },
        {
            "numero": 175,
            "enunciado": "Uma família decidiu comprar um aparelho \ncondicionador de ar usando como critério de escolha \nseu consumo mensal de energia. Suponha que o valor \nde 1 kWh da conta de energia elétrica dessa família \ncuste\tR$\t0,58\t(impostos\t incluídos)\t e\tque\thá\tbandeira\t\ntarifária\tvermelha\t correspondendo\t a\tR$\t0,045\tpara\tcada\t\n1 kWh consumido. \nO uso desse aparelho deve representar um \nacréscimo mensal na conta de energia elétrica da  \nfamília\tde\tR$\t150,00.\nO consumo de energia elétrica mensal mais próximo, \nem\tquilowatt-hora,\tque\to\taparelho\tdeve\tter\té\tigual\ta\nA A 286.\nB B 280.\nC C 259.\nD D 240.\nE E 146.",
            "pergunta": "Pergunta não detectada",
            "alternativas": {
                "A": "A 286.",
                "B": "B 280.",
                "C": "C 259.",
                "D": "D 240.",
                "E": "E 146."
            },
            "bibliografia": "Não Informada"
        },
        {
            "numero": 176,
            "enunciado": "Em\tbusca\tde\tdiversificar\t a\tvivência\tdo\tfilho,\tseus\t\npais registraram a quantidade de horas de uso diário \ndo aparelho celular dele durante a primeira semana \nde agosto. O resultado desse registro, em hora, foi o \nseguinte:\n• segunda-feira:\t5;\n• terça-feira:\t2;\n• quarta-feira:\t9;\n• quinta-feira:\t2;\n• sexta-feira:\t8;\n• sábado: 12;\n• domingo: 4.\nCom base nesse registro, os pais planejaram incluir \natividades\t físicas\te\tculturais\tna\tvivência\tdo\tfilho\tno\t\nsábado da segunda semana do mesmo mês.\nConsequentemente, a quantidade de horas de uso \ndo aparelho no sábado deveria ser reduzida, de modo \nque a média diária de uso na segunda semana fosse, \nno mínimo, uma hora a menos do que a média diária na \nprimeira semana. Ao longo dos demais dias da segunda \nsemana, a quantidade de horas de uso do aparelho seria \na mesma da primeira semana.\n\nA A 4\nB B 5\nC C 6\nD D 10\nE E 11",
            "pergunta": "Qual é a quantidade máxima de horas de uso do \naparelho no sábado da segunda semana que atende \nao\tplanejamento\tdos\tpais?",
            "alternativas": {
                "A": "A 4",
                "B": "B 5",
                "C": "C 6",
                "D": "D 10",
                "E": "E 11"
            },
            "bibliografia": "Não Informada"
        },
        {
            "numero": 177,
            "enunciado": "Um jovem, no trajeto que usa para ir para a escola, \nsempre passa por um grande relógio digital que há no \ncentro da sua cidade e compara a hora nele mostrada \ncom a hora que marca o seu relógio de pulso. Ao longo \nde\t30\tdias\tde\tobservação,\t constata\tque\to\tseu\trelógio\t  \natrasa\t2\tminutos,\ta\tcada\t15\tdias,\tem\trelação\tao\tdo\tcentro\t\nda cidade.\nApós 90 dias, sem nenhum dos dois relógios \nreceberem ajustes e mantida a mesma parcela de atraso \ndiário, ao ler as marcações de horário dos dois relógios, \nverificou\tque\to\tdo\tcentro\tda\tcidade\tmarcava\texatamente\t\n7 horas.\n\nA A 6 h e 48 min\nB B 6 h e 54 min\nC C 6 h e 58 min\nD D 7 h e 06 min\nE E 7 h e 12 min",
            "pergunta": "Qual horário marcava seu relógio de pulso nesse \ninstante?",
            "alternativas": {
                "A": "A 6 h e 48 min",
                "B": "B 6 h e 54 min",
                "C": "C 6 h e 58 min",
                "D": "D 7 h e 06 min",
                "E": "E 7 h e 12 min"
            },
            "bibliografia": "Não Informada"
        },
        {
            "numero": 178,
            "enunciado": "Um\tcarcinicultor\t tem\tum\tviveiro\tde\tcamarão\t cuja\t\ncerca na superfície tem formato de um trapézio isósceles. \nA base maior e a altura desse trapézio têm medidas, \nrespectivamente, de 45 e 20 metros. Para manter \numa\tprodução\tde\tqualidade,\t ele\tsegue\to\tpadrão\tde\t \n10 camarões para cada metro quadrado da área  \ndelimitada\t para\to\tviveiro,\tcom\tuma\tprodução\t atual\t\ncorrespondente a 6 000 camarões. Mantendo o \nmesmo\tpadrão\tde\tqualidade,\t ele\tpretende\t aumentar\t a\t\ncapacidade produtiva desse viveiro em 2 400 unidades \nde\tcamarão,\t com\ta\tampliação\t da\tárea\tdelimitada\t para\t\no\tviveiro,\tmodificando\t apenas\ta\tmedida\tda\tbase\tmenor\t  \ndo trapézio.\n\nA A 21\nB B 24\nC C 36\nD D 39\nE E 54*020325AZ30*\n 31\nMT - 2° dia | Caderno 7 - AZUL - 2ª Aplicação\nENEM 2022 ENEM 2022 ENEM 2022 ENEM 2022 ENEM 2022 ENEM 2022 ENEM 2022 ENEM 2022 ENEM 2022 ENEM 2022 ENEM 2022 ENEM 2022 ENEM 2022 ENEM 2022 ENEM 2022 ENEM 2022 ENEM 2022 ENEM 2022 ENEM 2022 ENEM 2022 ENEM 2022 ENEM 2022 ENEM 2022 ENEM 2022 ENEM 2022 ENEM 2022 ENEM 2022 ENEM 2022 ENEM 2022 ENEM 2022 ENEM 2022 ENEM 2022 ENEM 2022 ENEM 2022 ENEM 2022 ENEM 2022 ENEM 2022 ENEM 2022 ENEM 2022 ENEM 2022 ENEM 2022 ENEM 2022 ENEM 2022 ENEM 2022 ENEM 2022 ENEM 2022 ENEM 2022 ENEM 2022 ENEM 2022 ENEM 2022 ENEM 2022 ENEM 2022 ENEM 2022 ENEM 2022 ENEM 2022 ENEM 2022 ENEM 2022 ENEM 2022 ENEM 2022 ENEM 2022 ENEM 2022 ENEM 2022 ENEM 2022",
            "pergunta": "Em quantos metros ele deverá aumentar a medida da \nbase menor do trapézio para alcançar a capacidade \nprodutiva\tdesejada?",
            "alternativas": {
                "A": "A 21",
                "B": "B 24",
                "C": "C 36",
                "D": "D 39",
                "E": "E 54"
            },
            "bibliografia": "Não Informada"
        },
        {
            "numero": 179,
            "enunciado": "Um proprietário precisa comprar tubos para \nligações hidráulicas durante a reforma de sua casa, \noptando pela compra do material de menor custo. \nO\tengenheiro\t responsável\t pela\tobra\tafirmou\tao\t\nproprietário\t que\tos\ttubos\tprecisam\t suportar\tuma\tvazão\t\nde\t1,2\tlitro\tpor\tsegundo.\t Para\tmanter\to\tpadrão\tdas\t\ntubulações já existentes na casa, os tubos devem ter \n15,\t20\tou\t25\tmm\tde\tdiâmetro.\t Uma\tloja\tde\tmateriais\t\nde\tconstrução\t apresentou\t ao\tproprietário\t o\tquadro\tno\t\nqual\tse\tencontram\t cinco\ttipos\tde\ttubo,\tcom\tindicação \t\nde\tdiâmetro,\tvazão\te\tcusto\tpara\tcada\tum\tdeles.\nMATERIALDIÂMETRO \n(em mm)VAZÃO\n(em L/s)CUSTO\n(em R$/m)\nPVC\nsoldável15 0,40 0,50\n20 1,20 1,25\n25 1,25 1,35\nPEX15 0,50 0,65\n20 1,10 1,05\n25 1,20 1,35\nPolipropileno15 0,60 0,30\n20 1,20 1,25\n25 1,30 1,55\nPVC\nroscável15 0,50 0,80\n20 1,10 1,10\n25 1,20 1,15\nPolietileno \nreticulado15 0,60 0,35\n20 1,20 1,20\n25 1,30 1,25\nO proprietário deverá comprar\nA A PVC\tsoldável\tcom\t20\tmm\tde\tdiâmetro.\nB B PEX\tcom\t20\tmm\tde\tdiâmetro.\nC C Polipropileno\tcom\t15\tmm\tde\tdiâmetro.\nD D PVC\troscável\tcom\t25\tmm\tde\tdiâmetro.\nE E Polietileno\treticulado\tcom\t20\tmm\tde\tdiâmetro.",
            "pergunta": "Pergunta não detectada",
            "alternativas": {
                "A": "A PVC\tsoldável\tcom\t20\tmm\tde\tdiâmetro.",
                "B": "B PEX\tcom\t20\tmm\tde\tdiâmetro.",
                "C": "C Polipropileno\tcom\t15\tmm\tde\tdiâmetro.",
                "D": "D PVC\troscável\tcom\t25\tmm\tde\tdiâmetro.",
                "E": "E Polietileno\treticulado\tcom\t20\tmm\tde\tdiâmetro."
            },
            "bibliografia": "Não Informada"
        },
        {
            "numero": 180,
            "enunciado": "Um cortador de grama elétrico tem o cabo plugado \nem\tuma\ttomada\tfixa\trente\tao\tsolo\tplano\tde\tum\tgramado.\t\nO cabo de energia mede 5 metros, e o cortador tem uma \nlâmina\tque\tcorta\t1\tmetro\tde\tlargura.\tAtualmente\t ele\tcorta,\t\nportanto,\tuma\tregião\tno\tformato\tde\tcírculo\tde\traio\t6\tm,\t\ncomo\tilustra\ta\tfigura.\tPretende-se\t usar\tadicionalmente\t\num cabo extensor, de modo que seja possível cortar uma \nregião\tcom\to\tdobro\tda\tárea\tque\tcorta\tatualmente.\n\nA A 12,0\nB B 8,5\nC C 6,0\nD D 3,0\nE E 2,5*020325AZ31*\n32 \n2° dia | Caderno 7 - AZUL - 2ª Aplicação03\n02",
            "pergunta": "Cortador de\ngrama\nCabo\nTomada1 m\n5 m\nQual a medida aproximada, em metro, do comprimento \ndo\tcabo\textensor?",
            "alternativas": {
                "A": "A 12,0",
                "B": "B 8,5",
                "C": "C 6,0",
                "D": "D 3,0",
                "E": "E 2,5"
            },
            "bibliografia": "Não Informada"
        }
    ]
}